{
  "ceo": {
    "nome_completo": "Maria Costa",
    "primeiro_nome": "Maria",
    "sobrenome": "Costa",
    "idade": 43,
    "genero": "feminino",
    "pais_origem": "Argentina",
    "nacionalidade": "latinos",
    "role": "CEO",
    "categoria": "executivos",
    "especializacao": "LideranÃ§a Executiva e GestÃ£o EstratÃ©gica",
    "educacao": "MBA em LideranÃ§a pela Wharton School",
    "anos_experiencia": 21,
    "idiomas": [
      "inglÃªs",
      "alemÃ£o",
      "portuguÃªs",
      "japonÃªs",
      "espanhol",
      "francÃªs"
    ],
    "biografia_md": "# ğŸ‘¤ Maria Costa\n\n## ğŸ“‹ **INFORMAÃ‡Ã•ES BÃSICAS**\n- **Nome:** Maria Costa\n- **Idade:** 43 anos\n- **Nacionalidade:** Argentina\n- **Cargo:** CEO\n- **EspecializaÃ§Ã£o:** LideranÃ§a Executiva e GestÃ£o EstratÃ©gica\n\n## ğŸ“ **FORMAÃ‡ÃƒO ACADÃŠMICA**\nMBA em LideranÃ§a pela Wharton School\n\n## ğŸ’¼ **EXPERIÃŠNCIA PROFISSIONAL**\nCom 21 anos de experiÃªncia na Ã¡rea de lideranÃ§a executiva e gestÃ£o estratÃ©gica, Maria Costa traz uma perspectiva Ãºnica e valiosa para a TechVision Solutions. \n\nAo longo de sua carreira, ela desenvolveu competÃªncias sÃ³lidas em:\n- GestÃ£o estratÃ©gica e operacional\n- LideranÃ§a de equipes multiculturais\n- Desenvolvimento e implementaÃ§Ã£o de processos\n- AnÃ¡lise e otimizaÃ§Ã£o de resultados\n- ComunicaÃ§Ã£o executiva eficaz\n\n## ğŸŒ **COMPETÃŠNCIAS LINGUÃSTICAS**\n**Idiomas:** inglÃªs, alemÃ£o, portuguÃªs, japonÃªs, espanhol, francÃªs\n\n## ğŸ¯ **RESPONSABILIDADES NA TECHVISION SOLUTIONS**\nComo CEO, Maria Costa Ã© responsÃ¡vel por:\n- Suporte direto Ã s operaÃ§Ãµes estratÃ©gicas da empresa\n- CoordenaÃ§Ã£o de atividades relacionadas Ã  lideranÃ§a executiva e gestÃ£o estratÃ©gica\n- ImplementaÃ§Ã£o de melhores prÃ¡ticas na Ã¡rea de tecnologia\n- ColaboraÃ§Ã£o com equipes internas e stakeholders externos\n- Desenvolvimento e execuÃ§Ã£o de iniciativas de crescimento\n\n## ğŸ’¡ **COMPETÃŠNCIAS TÃ‰CNICAS**\n- DomÃ­nio de ferramentas de gestÃ£o empresarial\n- Conhecimento avanÃ§ado em metodologias Ã¡geis\n- ExperiÃªncia com sistemas de CRM e ERP\n- AnÃ¡lise de dados e KPIs\n- GestÃ£o de projetos complexos\n\n## ğŸ¤ **COMPETÃŠNCIAS COMPORTAMENTAIS**\n- LideranÃ§a inspiradora e colaborativa\n- ComunicaÃ§Ã£o assertiva e empÃ¡tica\n- Adaptabilidade e flexibilidade\n- Pensamento estratÃ©gico\n- OrientaÃ§Ã£o para resultados\n- Trabalho em equipe multicultural\n\n## ğŸ“ˆ **OBJETIVOS E METAS**\nMaria Costa estÃ¡ focado(a) em contribuir para o crescimento sustentÃ¡vel da TechVision Solutions, aplicando sua experiÃªncia em lideranÃ§a executiva e gestÃ£o estratÃ©gica para:\n- Otimizar processos e aumentar a eficiÃªncia operacional\n- Desenvolver soluÃ§Ãµes inovadoras para desafios do setor de tecnologia\n- Fortalecer a cultura organizacional e o engajamento da equipe\n- Expandir a presenÃ§a da empresa no mercado internacional\n\n---\n*Biografia gerada automaticamente pelo Virtual Company Generator v2.0.0*\n*Data: 09/11/2025*",
    "especialidade": null,
    "is_ceo": true
  },
  "executivos": {
    "executivo_m_1": {
      "nome_completo": "Pablo Sanchez",
      "primeiro_nome": "Pablo",
      "sobrenome": "Sanchez",
      "idade": 40,
      "genero": "masculino",
      "pais_origem": "Peru",
      "nacionalidade": "latinos",
      "role": "Executivo",
      "categoria": "executivos",
      "especializacao": "GestÃ£o de Projetos e InovaÃ§Ã£o",
      "educacao": "Mestrado em EstratÃ©gia Empresarial pela Cambridge Judge Business School",
      "anos_experiencia": 18,
      "idiomas": [
        "francÃªs",
        "inglÃªs",
        "japonÃªs"
      ],
      "biografia_md": "# ğŸ‘¤ Pablo Sanchez\n\n## ğŸ“‹ **INFORMAÃ‡Ã•ES BÃSICAS**\n- **Nome:** Pablo Sanchez\n- **Idade:** 40 anos\n- **Nacionalidade:** Peru\n- **Cargo:** Executivo\n- **EspecializaÃ§Ã£o:** GestÃ£o de Projetos e InovaÃ§Ã£o\n\n## ğŸ“ **FORMAÃ‡ÃƒO ACADÃŠMICA**\nMestrado em EstratÃ©gia Empresarial pela Cambridge Judge Business School\n\n## ğŸ’¼ **EXPERIÃŠNCIA PROFISSIONAL**\nCom 18 anos de experiÃªncia na Ã¡rea de gestÃ£o de projetos e inovaÃ§Ã£o, Pablo Sanchez traz uma perspectiva Ãºnica e valiosa para a TechVision Solutions. \n\nAo longo de sua carreira, ela desenvolveu competÃªncias sÃ³lidas em:\n- GestÃ£o estratÃ©gica e operacional\n- LideranÃ§a de equipes multiculturais\n- Desenvolvimento e implementaÃ§Ã£o de processos\n- AnÃ¡lise e otimizaÃ§Ã£o de resultados\n- ComunicaÃ§Ã£o executiva eficaz\n\n## ğŸŒ **COMPETÃŠNCIAS LINGUÃSTICAS**\n**Idiomas:** francÃªs, inglÃªs, japonÃªs\n\n## ğŸ¯ **RESPONSABILIDADES NA TECHVISION SOLUTIONS**\nComo Executivo, Pablo Sanchez Ã© responsÃ¡vel por:\n- Suporte direto Ã s operaÃ§Ãµes estratÃ©gicas da empresa\n- CoordenaÃ§Ã£o de atividades relacionadas Ã  gestÃ£o de projetos e inovaÃ§Ã£o\n- ImplementaÃ§Ã£o de melhores prÃ¡ticas na Ã¡rea de tecnologia\n- ColaboraÃ§Ã£o com equipes internas e stakeholders externos\n- Desenvolvimento e execuÃ§Ã£o de iniciativas de crescimento\n\n## ğŸ’¡ **COMPETÃŠNCIAS TÃ‰CNICAS**\n- DomÃ­nio de ferramentas de gestÃ£o empresarial\n- Conhecimento avanÃ§ado em metodologias Ã¡geis\n- ExperiÃªncia com sistemas de CRM e ERP\n- AnÃ¡lise de dados e KPIs\n- GestÃ£o de projetos complexos\n\n## ğŸ¤ **COMPETÃŠNCIAS COMPORTAMENTAIS**\n- LideranÃ§a inspiradora e colaborativa\n- ComunicaÃ§Ã£o assertiva e empÃ¡tica\n- Adaptabilidade e flexibilidade\n- Pensamento estratÃ©gico\n- OrientaÃ§Ã£o para resultados\n- Trabalho em equipe multicultural\n\n## ğŸ“ˆ **OBJETIVOS E METAS**\nPablo Sanchez estÃ¡ focado(a) em contribuir para o crescimento sustentÃ¡vel da TechVision Solutions, aplicando sua experiÃªncia em gestÃ£o de projetos e inovaÃ§Ã£o para:\n- Otimizar processos e aumentar a eficiÃªncia operacional\n- Desenvolver soluÃ§Ãµes inovadoras para desafios do setor de tecnologia\n- Fortalecer a cultura organizacional e o engajamento da equipe\n- Expandir a presenÃ§a da empresa no mercado internacional\n\n---\n*Biografia gerada automaticamente pelo Virtual Company Generator v2.0.0*\n*Data: 09/11/2025*",
      "especialidade": null,
      "is_ceo": false
    },
    "executivo_m_2": {
      "nome_completo": "JoÃ£o Oliveira",
      "primeiro_nome": "JoÃ£o",
      "sobrenome": "Oliveira",
      "idade": 38,
      "genero": "masculino",
      "pais_origem": "Uruguai",
      "nacionalidade": "latinos",
      "role": "Executivo",
      "categoria": "executivos",
      "especializacao": "GestÃ£o de OperaÃ§Ãµes e Processos",
      "educacao": "Mestrado em EstratÃ©gia Empresarial pela Cambridge Judge Business School",
      "anos_experiencia": 16,
      "idiomas": [
        "japonÃªs",
        "portuguÃªs",
        "francÃªs",
        "inglÃªs",
        "alemÃ£o",
        "espanhol"
      ],
      "biografia_md": "# ğŸ‘¤ JoÃ£o Oliveira\n\n## ğŸ“‹ **INFORMAÃ‡Ã•ES BÃSICAS**\n- **Nome:** JoÃ£o Oliveira\n- **Idade:** 38 anos\n- **Nacionalidade:** Uruguai\n- **Cargo:** Executivo\n- **EspecializaÃ§Ã£o:** GestÃ£o de OperaÃ§Ãµes e Processos\n\n## ğŸ“ **FORMAÃ‡ÃƒO ACADÃŠMICA**\nMestrado em EstratÃ©gia Empresarial pela Cambridge Judge Business School\n\n## ğŸ’¼ **EXPERIÃŠNCIA PROFISSIONAL**\nCom 16 anos de experiÃªncia na Ã¡rea de gestÃ£o de operaÃ§Ãµes e processos, JoÃ£o Oliveira traz uma perspectiva Ãºnica e valiosa para a TechVision Solutions. \n\nAo longo de sua carreira, ele desenvolveu competÃªncias sÃ³lidas em:\n- GestÃ£o estratÃ©gica e operacional\n- LideranÃ§a de equipes multiculturais\n- Desenvolvimento e implementaÃ§Ã£o de processos\n- AnÃ¡lise e otimizaÃ§Ã£o de resultados\n- ComunicaÃ§Ã£o executiva eficaz\n\n## ğŸŒ **COMPETÃŠNCIAS LINGUÃSTICAS**\n**Idiomas:** japonÃªs, portuguÃªs, francÃªs, inglÃªs, alemÃ£o, espanhol\n\n## ğŸ¯ **RESPONSABILIDADES NA TECHVISION SOLUTIONS**\nComo Executivo, JoÃ£o Oliveira Ã© responsÃ¡vel por:\n- Suporte direto Ã s operaÃ§Ãµes estratÃ©gicas da empresa\n- CoordenaÃ§Ã£o de atividades relacionadas Ã  gestÃ£o de operaÃ§Ãµes e processos\n- ImplementaÃ§Ã£o de melhores prÃ¡ticas na Ã¡rea de tecnologia\n- ColaboraÃ§Ã£o com equipes internas e stakeholders externos\n- Desenvolvimento e execuÃ§Ã£o de iniciativas de crescimento\n\n## ğŸ’¡ **COMPETÃŠNCIAS TÃ‰CNICAS**\n- DomÃ­nio de ferramentas de gestÃ£o empresarial\n- Conhecimento avanÃ§ado em metodologias Ã¡geis\n- ExperiÃªncia com sistemas de CRM e ERP\n- AnÃ¡lise de dados e KPIs\n- GestÃ£o de projetos complexos\n\n## ğŸ¤ **COMPETÃŠNCIAS COMPORTAMENTAIS**\n- LideranÃ§a inspiradora e colaborativa\n- ComunicaÃ§Ã£o assertiva e empÃ¡tica\n- Adaptabilidade e flexibilidade\n- Pensamento estratÃ©gico\n- OrientaÃ§Ã£o para resultados\n- Trabalho em equipe multicultural\n\n## ğŸ“ˆ **OBJETIVOS E METAS**\nJoÃ£o Oliveira estÃ¡ focado(a) em contribuir para o crescimento sustentÃ¡vel da TechVision Solutions, aplicando sua experiÃªncia em gestÃ£o de operaÃ§Ãµes e processos para:\n- Otimizar processos e aumentar a eficiÃªncia operacional\n- Desenvolver soluÃ§Ãµes inovadoras para desafios do setor de tecnologia\n- Fortalecer a cultura organizacional e o engajamento da equipe\n- Expandir a presenÃ§a da empresa no mercado internacional\n\n---\n*Biografia gerada automaticamente pelo Virtual Company Generator v2.0.0*\n*Data: 09/11/2025*",
      "especialidade": null,
      "is_ceo": false
    },
    "executiva_f_1": {
      "nome_completo": "Fernanda Fernandez",
      "primeiro_nome": "Fernanda",
      "sobrenome": "Fernandez",
      "idade": 30,
      "genero": "feminino",
      "pais_origem": "Equador",
      "nacionalidade": "latinos",
      "role": "Executiva",
      "categoria": "executivos",
      "especializacao": "Desenvolvimento de NegÃ³cios e EstratÃ©gia",
      "educacao": "Mestrado em GestÃ£o EstratÃ©gica pela INSEAD",
      "anos_experiencia": 8,
      "idiomas": [
        "portuguÃªs",
        "japonÃªs",
        "inglÃªs",
        "alemÃ£o",
        "espanhol",
        "francÃªs"
      ],
      "biografia_md": "# ğŸ‘¤ Fernanda Fernandez\n\n## ğŸ“‹ **INFORMAÃ‡Ã•ES BÃSICAS**\n- **Nome:** Fernanda Fernandez\n- **Idade:** 30 anos\n- **Nacionalidade:** Equador\n- **Cargo:** Executiva\n- **EspecializaÃ§Ã£o:** Desenvolvimento de NegÃ³cios e EstratÃ©gia\n\n## ğŸ“ **FORMAÃ‡ÃƒO ACADÃŠMICA**\nMestrado em GestÃ£o EstratÃ©gica pela INSEAD\n\n## ğŸ’¼ **EXPERIÃŠNCIA PROFISSIONAL**\nCom 8 anos de experiÃªncia na Ã¡rea de desenvolvimento de negÃ³cios e estratÃ©gia, Fernanda Fernandez traz uma perspectiva Ãºnica e valiosa para a TechVision Solutions. \n\nAo longo de sua carreira, ela desenvolveu competÃªncias sÃ³lidas em:\n- GestÃ£o estratÃ©gica e operacional\n- LideranÃ§a de equipes multiculturais\n- Desenvolvimento e implementaÃ§Ã£o de processos\n- AnÃ¡lise e otimizaÃ§Ã£o de resultados\n- ComunicaÃ§Ã£o executiva eficaz\n\n## ğŸŒ **COMPETÃŠNCIAS LINGUÃSTICAS**\n**Idiomas:** portuguÃªs, japonÃªs, inglÃªs, alemÃ£o, espanhol, francÃªs\n\n## ğŸ¯ **RESPONSABILIDADES NA TECHVISION SOLUTIONS**\nComo Executiva, Fernanda Fernandez Ã© responsÃ¡vel por:\n- Suporte direto Ã s operaÃ§Ãµes estratÃ©gicas da empresa\n- CoordenaÃ§Ã£o de atividades relacionadas Ã  desenvolvimento de negÃ³cios e estratÃ©gia\n- ImplementaÃ§Ã£o de melhores prÃ¡ticas na Ã¡rea de tecnologia\n- ColaboraÃ§Ã£o com equipes internas e stakeholders externos\n- Desenvolvimento e execuÃ§Ã£o de iniciativas de crescimento\n\n## ğŸ’¡ **COMPETÃŠNCIAS TÃ‰CNICAS**\n- DomÃ­nio de ferramentas de gestÃ£o empresarial\n- Conhecimento avanÃ§ado em metodologias Ã¡geis\n- ExperiÃªncia com sistemas de CRM e ERP\n- AnÃ¡lise de dados e KPIs\n- GestÃ£o de projetos complexos\n\n## ğŸ¤ **COMPETÃŠNCIAS COMPORTAMENTAIS**\n- LideranÃ§a inspiradora e colaborativa\n- ComunicaÃ§Ã£o assertiva e empÃ¡tica\n- Adaptabilidade e flexibilidade\n- Pensamento estratÃ©gico\n- OrientaÃ§Ã£o para resultados\n- Trabalho em equipe multicultural\n\n## ğŸ“ˆ **OBJETIVOS E METAS**\nFernanda Fernandez estÃ¡ focado(a) em contribuir para o crescimento sustentÃ¡vel da TechVision Solutions, aplicando sua experiÃªncia em desenvolvimento de negÃ³cios e estratÃ©gia para:\n- Otimizar processos e aumentar a eficiÃªncia operacional\n- Desenvolver soluÃ§Ãµes inovadoras para desafios do setor de tecnologia\n- Fortalecer a cultura organizacional e o engajamento da equipe\n- Expandir a presenÃ§a da empresa no mercado internacional\n\n---\n*Biografia gerada automaticamente pelo Virtual Company Generator v2.0.0*\n*Data: 09/11/2025*",
      "especialidade": null,
      "is_ceo": false
    },
    "executiva_f_2": {
      "nome_completo": "Maria Fernandez",
      "primeiro_nome": "Maria",
      "sobrenome": "Fernandez",
      "idade": 42,
      "genero": "feminino",
      "pais_origem": "Chile",
      "nacionalidade": "latinos",
      "role": "Executiva",
      "categoria": "executivos",
      "especializacao": "Desenvolvimento de NegÃ³cios e EstratÃ©gia",
      "educacao": "Mestrado em EstratÃ©gia Empresarial pela Cambridge Judge Business School",
      "anos_experiencia": 20,
      "idiomas": [
        "japonÃªs",
        "espanhol",
        "alemÃ£o",
        "portuguÃªs"
      ],
      "biografia_md": "# ğŸ‘¤ Maria Fernandez\n\n## ğŸ“‹ **INFORMAÃ‡Ã•ES BÃSICAS**\n- **Nome:** Maria Fernandez\n- **Idade:** 42 anos\n- **Nacionalidade:** Chile\n- **Cargo:** Executiva\n- **EspecializaÃ§Ã£o:** Desenvolvimento de NegÃ³cios e EstratÃ©gia\n\n## ğŸ“ **FORMAÃ‡ÃƒO ACADÃŠMICA**\nMestrado em EstratÃ©gia Empresarial pela Cambridge Judge Business School\n\n## ğŸ’¼ **EXPERIÃŠNCIA PROFISSIONAL**\nCom 20 anos de experiÃªncia na Ã¡rea de desenvolvimento de negÃ³cios e estratÃ©gia, Maria Fernandez traz uma perspectiva Ãºnica e valiosa para a TechVision Solutions. \n\nAo longo de sua carreira, ela desenvolveu competÃªncias sÃ³lidas em:\n- GestÃ£o estratÃ©gica e operacional\n- LideranÃ§a de equipes multiculturais\n- Desenvolvimento e implementaÃ§Ã£o de processos\n- AnÃ¡lise e otimizaÃ§Ã£o de resultados\n- ComunicaÃ§Ã£o executiva eficaz\n\n## ğŸŒ **COMPETÃŠNCIAS LINGUÃSTICAS**\n**Idiomas:** japonÃªs, espanhol, alemÃ£o, portuguÃªs\n\n## ğŸ¯ **RESPONSABILIDADES NA TECHVISION SOLUTIONS**\nComo Executiva, Maria Fernandez Ã© responsÃ¡vel por:\n- Suporte direto Ã s operaÃ§Ãµes estratÃ©gicas da empresa\n- CoordenaÃ§Ã£o de atividades relacionadas Ã  desenvolvimento de negÃ³cios e estratÃ©gia\n- ImplementaÃ§Ã£o de melhores prÃ¡ticas na Ã¡rea de tecnologia\n- ColaboraÃ§Ã£o com equipes internas e stakeholders externos\n- Desenvolvimento e execuÃ§Ã£o de iniciativas de crescimento\n\n## ğŸ’¡ **COMPETÃŠNCIAS TÃ‰CNICAS**\n- DomÃ­nio de ferramentas de gestÃ£o empresarial\n- Conhecimento avanÃ§ado em metodologias Ã¡geis\n- ExperiÃªncia com sistemas de CRM e ERP\n- AnÃ¡lise de dados e KPIs\n- GestÃ£o de projetos complexos\n\n## ğŸ¤ **COMPETÃŠNCIAS COMPORTAMENTAIS**\n- LideranÃ§a inspiradora e colaborativa\n- ComunicaÃ§Ã£o assertiva e empÃ¡tica\n- Adaptabilidade e flexibilidade\n- Pensamento estratÃ©gico\n- OrientaÃ§Ã£o para resultados\n- Trabalho em equipe multicultural\n\n## ğŸ“ˆ **OBJETIVOS E METAS**\nMaria Fernandez estÃ¡ focado(a) em contribuir para o crescimento sustentÃ¡vel da TechVision Solutions, aplicando sua experiÃªncia em desenvolvimento de negÃ³cios e estratÃ©gia para:\n- Otimizar processos e aumentar a eficiÃªncia operacional\n- Desenvolver soluÃ§Ãµes inovadoras para desafios do setor de tecnologia\n- Fortalecer a cultura organizacional e o engajamento da equipe\n- Expandir a presenÃ§a da empresa no mercado internacional\n\n---\n*Biografia gerada automaticamente pelo Virtual Company Generator v2.0.0*\n*Data: 09/11/2025*",
      "especialidade": null,
      "is_ceo": false
    }
  },
  "assistentes": {
    "assistente_m_1": {
      "nome_completo": "Manuel Silva",
      "primeiro_nome": "Manuel",
      "sobrenome": "Silva",
      "idade": 31,
      "genero": "masculino",
      "pais_origem": "Equador",
      "nacionalidade": "latinos",
      "role": "Assistente Executivo",
      "categoria": "assistentes",
      "especializacao": "Suporte Executivo e GestÃ£o Administrativa",
      "educacao": "Curso Superior em GestÃ£o de Recursos Humanos",
      "anos_experiencia": 9,
      "idiomas": [
        "inglÃªs",
        "japonÃªs",
        "portuguÃªs",
        "espanhol",
        "francÃªs",
        "alemÃ£o"
      ],
      "biografia_md": "# ğŸ‘¤ Manuel Silva\n\n## ğŸ“‹ **INFORMAÃ‡Ã•ES BÃSICAS**\n- **Nome:** Manuel Silva\n- **Idade:** 31 anos\n- **Nacionalidade:** Equador\n- **Cargo:** Assistente Executivo\n- **EspecializaÃ§Ã£o:** Suporte Executivo e GestÃ£o Administrativa\n\n## ğŸ“ **FORMAÃ‡ÃƒO ACADÃŠMICA**\nCurso Superior em GestÃ£o de Recursos Humanos\n\n## ğŸ’¼ **EXPERIÃŠNCIA PROFISSIONAL**\nCom 9 anos de experiÃªncia na Ã¡rea de suporte executivo e gestÃ£o administrativa, Manuel Silva traz uma perspectiva Ãºnica e valiosa para a TechVision Solutions. \n\nAo longo de sua carreira, ela desenvolveu competÃªncias sÃ³lidas em:\n- GestÃ£o estratÃ©gica e operacional\n- LideranÃ§a de equipes multiculturais\n- Desenvolvimento e implementaÃ§Ã£o de processos\n- AnÃ¡lise e otimizaÃ§Ã£o de resultados\n- ComunicaÃ§Ã£o executiva eficaz\n\n## ğŸŒ **COMPETÃŠNCIAS LINGUÃSTICAS**\n**Idiomas:** inglÃªs, japonÃªs, portuguÃªs, espanhol, francÃªs, alemÃ£o\n\n## ğŸ¯ **RESPONSABILIDADES NA TECHVISION SOLUTIONS**\nComo Assistente Executivo, Manuel Silva Ã© responsÃ¡vel por:\n- Suporte direto Ã s operaÃ§Ãµes estratÃ©gicas da empresa\n- CoordenaÃ§Ã£o de atividades relacionadas Ã  suporte executivo e gestÃ£o administrativa\n- ImplementaÃ§Ã£o de melhores prÃ¡ticas na Ã¡rea de tecnologia\n- ColaboraÃ§Ã£o com equipes internas e stakeholders externos\n- Desenvolvimento e execuÃ§Ã£o de iniciativas de crescimento\n\n## ğŸ’¡ **COMPETÃŠNCIAS TÃ‰CNICAS**\n- DomÃ­nio de ferramentas de gestÃ£o empresarial\n- Conhecimento avanÃ§ado em metodologias Ã¡geis\n- ExperiÃªncia com sistemas de CRM e ERP\n- AnÃ¡lise de dados e KPIs\n- GestÃ£o de projetos complexos\n\n## ğŸ¤ **COMPETÃŠNCIAS COMPORTAMENTAIS**\n- LideranÃ§a inspiradora e colaborativa\n- ComunicaÃ§Ã£o assertiva e empÃ¡tica\n- Adaptabilidade e flexibilidade\n- Pensamento estratÃ©gico\n- OrientaÃ§Ã£o para resultados\n- Trabalho em equipe multicultural\n\n## ğŸ“ˆ **OBJETIVOS E METAS**\nManuel Silva estÃ¡ focado(a) em contribuir para o crescimento sustentÃ¡vel da TechVision Solutions, aplicando sua experiÃªncia em suporte executivo e gestÃ£o administrativa para:\n- Otimizar processos e aumentar a eficiÃªncia operacional\n- Desenvolver soluÃ§Ãµes inovadoras para desafios do setor de tecnologia\n- Fortalecer a cultura organizacional e o engajamento da equipe\n- Expandir a presenÃ§a da empresa no mercado internacional\n\n---\n*Biografia gerada automaticamente pelo Virtual Company Generator v2.0.0*\n*Data: 09/11/2025*",
      "especialidade": null,
      "is_ceo": false
    },
    "assistente_m_2": {
      "nome_completo": "Ricardo Oliveira",
      "primeiro_nome": "Ricardo",
      "sobrenome": "Oliveira",
      "idade": 30,
      "genero": "masculino",
      "pais_origem": "Equador",
      "nacionalidade": "latinos",
      "role": "Assistente Executivo",
      "categoria": "assistentes",
      "especializacao": "Suporte Executivo e GestÃ£o Administrativa",
      "educacao": "Bacharelado em ComunicaÃ§Ã£o Social",
      "anos_experiencia": 8,
      "idiomas": [
        "francÃªs",
        "japonÃªs",
        "alemÃ£o",
        "portuguÃªs",
        "espanhol"
      ],
      "biografia_md": "# ğŸ‘¤ Ricardo Oliveira\n\n## ğŸ“‹ **INFORMAÃ‡Ã•ES BÃSICAS**\n- **Nome:** Ricardo Oliveira\n- **Idade:** 30 anos\n- **Nacionalidade:** Equador\n- **Cargo:** Assistente Executivo\n- **EspecializaÃ§Ã£o:** Suporte Executivo e GestÃ£o Administrativa\n\n## ğŸ“ **FORMAÃ‡ÃƒO ACADÃŠMICA**\nBacharelado em ComunicaÃ§Ã£o Social\n\n## ğŸ’¼ **EXPERIÃŠNCIA PROFISSIONAL**\nCom 8 anos de experiÃªncia na Ã¡rea de suporte executivo e gestÃ£o administrativa, Ricardo Oliveira traz uma perspectiva Ãºnica e valiosa para a TechVision Solutions. \n\nAo longo de sua carreira, ela desenvolveu competÃªncias sÃ³lidas em:\n- GestÃ£o estratÃ©gica e operacional\n- LideranÃ§a de equipes multiculturais\n- Desenvolvimento e implementaÃ§Ã£o de processos\n- AnÃ¡lise e otimizaÃ§Ã£o de resultados\n- ComunicaÃ§Ã£o executiva eficaz\n\n## ğŸŒ **COMPETÃŠNCIAS LINGUÃSTICAS**\n**Idiomas:** francÃªs, japonÃªs, alemÃ£o, portuguÃªs, espanhol\n\n## ğŸ¯ **RESPONSABILIDADES NA TECHVISION SOLUTIONS**\nComo Assistente Executivo, Ricardo Oliveira Ã© responsÃ¡vel por:\n- Suporte direto Ã s operaÃ§Ãµes estratÃ©gicas da empresa\n- CoordenaÃ§Ã£o de atividades relacionadas Ã  suporte executivo e gestÃ£o administrativa\n- ImplementaÃ§Ã£o de melhores prÃ¡ticas na Ã¡rea de tecnologia\n- ColaboraÃ§Ã£o com equipes internas e stakeholders externos\n- Desenvolvimento e execuÃ§Ã£o de iniciativas de crescimento\n\n## ğŸ’¡ **COMPETÃŠNCIAS TÃ‰CNICAS**\n- DomÃ­nio de ferramentas de gestÃ£o empresarial\n- Conhecimento avanÃ§ado em metodologias Ã¡geis\n- ExperiÃªncia com sistemas de CRM e ERP\n- AnÃ¡lise de dados e KPIs\n- GestÃ£o de projetos complexos\n\n## ğŸ¤ **COMPETÃŠNCIAS COMPORTAMENTAIS**\n- LideranÃ§a inspiradora e colaborativa\n- ComunicaÃ§Ã£o assertiva e empÃ¡tica\n- Adaptabilidade e flexibilidade\n- Pensamento estratÃ©gico\n- OrientaÃ§Ã£o para resultados\n- Trabalho em equipe multicultural\n\n## ğŸ“ˆ **OBJETIVOS E METAS**\nRicardo Oliveira estÃ¡ focado(a) em contribuir para o crescimento sustentÃ¡vel da TechVision Solutions, aplicando sua experiÃªncia em suporte executivo e gestÃ£o administrativa para:\n- Otimizar processos e aumentar a eficiÃªncia operacional\n- Desenvolver soluÃ§Ãµes inovadoras para desafios do setor de tecnologia\n- Fortalecer a cultura organizacional e o engajamento da equipe\n- Expandir a presenÃ§a da empresa no mercado internacional\n\n---\n*Biografia gerada automaticamente pelo Virtual Company Generator v2.0.0*\n*Data: 09/11/2025*",
      "especialidade": null,
      "is_ceo": false
    },
    "assistente_f_1": {
      "nome_completo": "Patricia Perez",
      "primeiro_nome": "Patricia",
      "sobrenome": "Perez",
      "idade": 35,
      "genero": "feminino",
      "pais_origem": "Peru",
      "nacionalidade": "latinos",
      "role": "Assistente Executiva",
      "categoria": "assistentes",
      "especializacao": "Suporte Executivo e GestÃ£o Administrativa",
      "educacao": "TecnÃ³logo em GestÃ£o Comercial",
      "anos_experiencia": 13,
      "idiomas": [
        "inglÃªs",
        "francÃªs",
        "japonÃªs",
        "espanhol",
        "portuguÃªs"
      ],
      "biografia_md": "# ğŸ‘¤ Patricia Perez\n\n## ğŸ“‹ **INFORMAÃ‡Ã•ES BÃSICAS**\n- **Nome:** Patricia Perez\n- **Idade:** 35 anos\n- **Nacionalidade:** Peru\n- **Cargo:** Assistente Executiva\n- **EspecializaÃ§Ã£o:** Suporte Executivo e GestÃ£o Administrativa\n\n## ğŸ“ **FORMAÃ‡ÃƒO ACADÃŠMICA**\nTecnÃ³logo em GestÃ£o Comercial\n\n## ğŸ’¼ **EXPERIÃŠNCIA PROFISSIONAL**\nCom 13 anos de experiÃªncia na Ã¡rea de suporte executivo e gestÃ£o administrativa, Patricia Perez traz uma perspectiva Ãºnica e valiosa para a TechVision Solutions. \n\nAo longo de sua carreira, ela desenvolveu competÃªncias sÃ³lidas em:\n- GestÃ£o estratÃ©gica e operacional\n- LideranÃ§a de equipes multiculturais\n- Desenvolvimento e implementaÃ§Ã£o de processos\n- AnÃ¡lise e otimizaÃ§Ã£o de resultados\n- ComunicaÃ§Ã£o executiva eficaz\n\n## ğŸŒ **COMPETÃŠNCIAS LINGUÃSTICAS**\n**Idiomas:** inglÃªs, francÃªs, japonÃªs, espanhol, portuguÃªs\n\n## ğŸ¯ **RESPONSABILIDADES NA TECHVISION SOLUTIONS**\nComo Assistente Executiva, Patricia Perez Ã© responsÃ¡vel por:\n- Suporte direto Ã s operaÃ§Ãµes estratÃ©gicas da empresa\n- CoordenaÃ§Ã£o de atividades relacionadas Ã  suporte executivo e gestÃ£o administrativa\n- ImplementaÃ§Ã£o de melhores prÃ¡ticas na Ã¡rea de tecnologia\n- ColaboraÃ§Ã£o com equipes internas e stakeholders externos\n- Desenvolvimento e execuÃ§Ã£o de iniciativas de crescimento\n\n## ğŸ’¡ **COMPETÃŠNCIAS TÃ‰CNICAS**\n- DomÃ­nio de ferramentas de gestÃ£o empresarial\n- Conhecimento avanÃ§ado em metodologias Ã¡geis\n- ExperiÃªncia com sistemas de CRM e ERP\n- AnÃ¡lise de dados e KPIs\n- GestÃ£o de projetos complexos\n\n## ğŸ¤ **COMPETÃŠNCIAS COMPORTAMENTAIS**\n- LideranÃ§a inspiradora e colaborativa\n- ComunicaÃ§Ã£o assertiva e empÃ¡tica\n- Adaptabilidade e flexibilidade\n- Pensamento estratÃ©gico\n- OrientaÃ§Ã£o para resultados\n- Trabalho em equipe multicultural\n\n## ğŸ“ˆ **OBJETIVOS E METAS**\nPatricia Perez estÃ¡ focado(a) em contribuir para o crescimento sustentÃ¡vel da TechVision Solutions, aplicando sua experiÃªncia em suporte executivo e gestÃ£o administrativa para:\n- Otimizar processos e aumentar a eficiÃªncia operacional\n- Desenvolver soluÃ§Ãµes inovadoras para desafios do setor de tecnologia\n- Fortalecer a cultura organizacional e o engajamento da equipe\n- Expandir a presenÃ§a da empresa no mercado internacional\n\n---\n*Biografia gerada automaticamente pelo Virtual Company Generator v2.0.0*\n*Data: 09/11/2025*",
      "especialidade": null,
      "is_ceo": false
    },
    "assistente_f_2": {
      "nome_completo": "Fernanda Gonzalez",
      "primeiro_nome": "Fernanda",
      "sobrenome": "Gonzalez",
      "idade": 33,
      "genero": "feminino",
      "pais_origem": "Uruguai",
      "nacionalidade": "latinos",
      "role": "Assistente Executiva",
      "categoria": "assistentes",
      "especializacao": "Suporte Executivo e GestÃ£o Administrativa",
      "educacao": "Bacharelado em RelaÃ§Ãµes PÃºblicas",
      "anos_experiencia": 11,
      "idiomas": [
        "japonÃªs",
        "espanhol",
        "inglÃªs",
        "alemÃ£o",
        "portuguÃªs",
        "francÃªs"
      ],
      "biografia_md": "# ğŸ‘¤ Fernanda Gonzalez\n\n## ğŸ“‹ **INFORMAÃ‡Ã•ES BÃSICAS**\n- **Nome:** Fernanda Gonzalez\n- **Idade:** 33 anos\n- **Nacionalidade:** Uruguai\n- **Cargo:** Assistente Executiva\n- **EspecializaÃ§Ã£o:** Suporte Executivo e GestÃ£o Administrativa\n\n## ğŸ“ **FORMAÃ‡ÃƒO ACADÃŠMICA**\nBacharelado em RelaÃ§Ãµes PÃºblicas\n\n## ğŸ’¼ **EXPERIÃŠNCIA PROFISSIONAL**\nCom 11 anos de experiÃªncia na Ã¡rea de suporte executivo e gestÃ£o administrativa, Fernanda Gonzalez traz uma perspectiva Ãºnica e valiosa para a TechVision Solutions. \n\nAo longo de sua carreira, ela desenvolveu competÃªncias sÃ³lidas em:\n- GestÃ£o estratÃ©gica e operacional\n- LideranÃ§a de equipes multiculturais\n- Desenvolvimento e implementaÃ§Ã£o de processos\n- AnÃ¡lise e otimizaÃ§Ã£o de resultados\n- ComunicaÃ§Ã£o executiva eficaz\n\n## ğŸŒ **COMPETÃŠNCIAS LINGUÃSTICAS**\n**Idiomas:** japonÃªs, espanhol, inglÃªs, alemÃ£o, portuguÃªs, francÃªs\n\n## ğŸ¯ **RESPONSABILIDADES NA TECHVISION SOLUTIONS**\nComo Assistente Executiva, Fernanda Gonzalez Ã© responsÃ¡vel por:\n- Suporte direto Ã s operaÃ§Ãµes estratÃ©gicas da empresa\n- CoordenaÃ§Ã£o de atividades relacionadas Ã  suporte executivo e gestÃ£o administrativa\n- ImplementaÃ§Ã£o de melhores prÃ¡ticas na Ã¡rea de tecnologia\n- ColaboraÃ§Ã£o com equipes internas e stakeholders externos\n- Desenvolvimento e execuÃ§Ã£o de iniciativas de crescimento\n\n## ğŸ’¡ **COMPETÃŠNCIAS TÃ‰CNICAS**\n- DomÃ­nio de ferramentas de gestÃ£o empresarial\n- Conhecimento avanÃ§ado em metodologias Ã¡geis\n- ExperiÃªncia com sistemas de CRM e ERP\n- AnÃ¡lise de dados e KPIs\n- GestÃ£o de projetos complexos\n\n## ğŸ¤ **COMPETÃŠNCIAS COMPORTAMENTAIS**\n- LideranÃ§a inspiradora e colaborativa\n- ComunicaÃ§Ã£o assertiva e empÃ¡tica\n- Adaptabilidade e flexibilidade\n- Pensamento estratÃ©gico\n- OrientaÃ§Ã£o para resultados\n- Trabalho em equipe multicultural\n\n## ğŸ“ˆ **OBJETIVOS E METAS**\nFernanda Gonzalez estÃ¡ focado(a) em contribuir para o crescimento sustentÃ¡vel da TechVision Solutions, aplicando sua experiÃªncia em suporte executivo e gestÃ£o administrativa para:\n- Otimizar processos e aumentar a eficiÃªncia operacional\n- Desenvolver soluÃ§Ãµes inovadoras para desafios do setor de tecnologia\n- Fortalecer a cultura organizacional e o engajamento da equipe\n- Expandir a presenÃ§a da empresa no mercado internacional\n\n---\n*Biografia gerada automaticamente pelo Virtual Company Generator v2.0.0*\n*Data: 09/11/2025*",
      "especialidade": null,
      "is_ceo": false
    },
    "assistente_f_3": {
      "nome_completo": "Maria Herrera",
      "primeiro_nome": "Maria",
      "sobrenome": "Herrera",
      "idade": 27,
      "genero": "feminino",
      "pais_origem": "Argentina",
      "nacionalidade": "latinos",
      "role": "Assistente Executiva",
      "categoria": "assistentes",
      "especializacao": "Suporte Executivo e GestÃ£o Administrativa",
      "educacao": "Curso Superior em GestÃ£o de Recursos Humanos",
      "anos_experiencia": 5,
      "idiomas": [
        "alemÃ£o",
        "japonÃªs",
        "francÃªs"
      ],
      "biografia_md": "# ğŸ‘¤ Maria Herrera\n\n## ğŸ“‹ **INFORMAÃ‡Ã•ES BÃSICAS**\n- **Nome:** Maria Herrera\n- **Idade:** 27 anos\n- **Nacionalidade:** Argentina\n- **Cargo:** Assistente Executiva\n- **EspecializaÃ§Ã£o:** Suporte Executivo e GestÃ£o Administrativa\n\n## ğŸ“ **FORMAÃ‡ÃƒO ACADÃŠMICA**\nCurso Superior em GestÃ£o de Recursos Humanos\n\n## ğŸ’¼ **EXPERIÃŠNCIA PROFISSIONAL**\nCom 5 anos de experiÃªncia na Ã¡rea de suporte executivo e gestÃ£o administrativa, Maria Herrera traz uma perspectiva Ãºnica e valiosa para a TechVision Solutions. \n\nAo longo de sua carreira, ela desenvolveu competÃªncias sÃ³lidas em:\n- GestÃ£o estratÃ©gica e operacional\n- LideranÃ§a de equipes multiculturais\n- Desenvolvimento e implementaÃ§Ã£o de processos\n- AnÃ¡lise e otimizaÃ§Ã£o de resultados\n- ComunicaÃ§Ã£o executiva eficaz\n\n## ğŸŒ **COMPETÃŠNCIAS LINGUÃSTICAS**\n**Idiomas:** alemÃ£o, japonÃªs, francÃªs\n\n## ğŸ¯ **RESPONSABILIDADES NA TECHVISION SOLUTIONS**\nComo Assistente Executiva, Maria Herrera Ã© responsÃ¡vel por:\n- Suporte direto Ã s operaÃ§Ãµes estratÃ©gicas da empresa\n- CoordenaÃ§Ã£o de atividades relacionadas Ã  suporte executivo e gestÃ£o administrativa\n- ImplementaÃ§Ã£o de melhores prÃ¡ticas na Ã¡rea de tecnologia\n- ColaboraÃ§Ã£o com equipes internas e stakeholders externos\n- Desenvolvimento e execuÃ§Ã£o de iniciativas de crescimento\n\n## ğŸ’¡ **COMPETÃŠNCIAS TÃ‰CNICAS**\n- DomÃ­nio de ferramentas de gestÃ£o empresarial\n- Conhecimento avanÃ§ado em metodologias Ã¡geis\n- ExperiÃªncia com sistemas de CRM e ERP\n- AnÃ¡lise de dados e KPIs\n- GestÃ£o de projetos complexos\n\n## ğŸ¤ **COMPETÃŠNCIAS COMPORTAMENTAIS**\n- LideranÃ§a inspiradora e colaborativa\n- ComunicaÃ§Ã£o assertiva e empÃ¡tica\n- Adaptabilidade e flexibilidade\n- Pensamento estratÃ©gico\n- OrientaÃ§Ã£o para resultados\n- Trabalho em equipe multicultural\n\n## ğŸ“ˆ **OBJETIVOS E METAS**\nMaria Herrera estÃ¡ focado(a) em contribuir para o crescimento sustentÃ¡vel da TechVision Solutions, aplicando sua experiÃªncia em suporte executivo e gestÃ£o administrativa para:\n- Otimizar processos e aumentar a eficiÃªncia operacional\n- Desenvolver soluÃ§Ãµes inovadoras para desafios do setor de tecnologia\n- Fortalecer a cultura organizacional e o engajamento da equipe\n- Expandir a presenÃ§a da empresa no mercado internacional\n\n---\n*Biografia gerada automaticamente pelo Virtual Company Generator v2.0.0*\n*Data: 09/11/2025*",
      "especialidade": null,
      "is_ceo": false
    }
  },
  "especialistas": {
    "especialista_hr": {
      "nome_completo": "Diego Santos",
      "primeiro_nome": "Diego",
      "sobrenome": "Santos",
      "idade": 34,
      "genero": "masculino",
      "pais_origem": "Argentina",
      "nacionalidade": "latinos",
      "role": "Especialista Recursos Humanos e GestÃ£o de Talentos",
      "categoria": "especialistas",
      "especializacao": "Recursos Humanos e GestÃ£o de Talentos",
      "educacao": "Bacharelado em Psicologia Organizacional e MBA em GestÃ£o de Pessoas",
      "anos_experiencia": 12,
      "idiomas": [
        "inglÃªs",
        "francÃªs",
        "portuguÃªs",
        "alemÃ£o",
        "espanhol"
      ],
      "biografia_md": "# ğŸ‘¤ Diego Santos\n\n## ğŸ“‹ **INFORMAÃ‡Ã•ES BÃSICAS**\n- **Nome:** Diego Santos\n- **Idade:** 34 anos\n- **Nacionalidade:** Argentina\n- **Cargo:** Especialista Recursos Humanos e GestÃ£o de Talentos\n- **EspecializaÃ§Ã£o:** Recursos Humanos e GestÃ£o de Talentos\n\n## ğŸ“ **FORMAÃ‡ÃƒO ACADÃŠMICA**\nBacharelado em Psicologia Organizacional e MBA em GestÃ£o de Pessoas\n\n## ğŸ’¼ **EXPERIÃŠNCIA PROFISSIONAL**\nCom 12 anos de experiÃªncia na Ã¡rea de recursos humanos e gestÃ£o de talentos, Diego Santos traz uma perspectiva Ãºnica e valiosa para a TechVision Solutions. \n\nAo longo de sua carreira, ele desenvolveu competÃªncias sÃ³lidas em:\n- GestÃ£o estratÃ©gica e operacional\n- LideranÃ§a de equipes multiculturais\n- Desenvolvimento e implementaÃ§Ã£o de processos\n- AnÃ¡lise e otimizaÃ§Ã£o de resultados\n- ComunicaÃ§Ã£o executiva eficaz\n\n## ğŸŒ **COMPETÃŠNCIAS LINGUÃSTICAS**\n**Idiomas:** inglÃªs, francÃªs, portuguÃªs, alemÃ£o, espanhol\n\n## ğŸ¯ **RESPONSABILIDADES NA TECHVISION SOLUTIONS**\nComo Especialista Recursos Humanos e GestÃ£o de Talentos, Diego Santos Ã© responsÃ¡vel por:\n- Suporte direto Ã s operaÃ§Ãµes estratÃ©gicas da empresa\n- CoordenaÃ§Ã£o de atividades relacionadas Ã  recursos humanos e gestÃ£o de talentos\n- ImplementaÃ§Ã£o de melhores prÃ¡ticas na Ã¡rea de tecnologia\n- ColaboraÃ§Ã£o com equipes internas e stakeholders externos\n- Desenvolvimento e execuÃ§Ã£o de iniciativas de crescimento\n\n## ğŸ’¡ **COMPETÃŠNCIAS TÃ‰CNICAS**\n- DomÃ­nio de ferramentas de gestÃ£o empresarial\n- Conhecimento avanÃ§ado em metodologias Ã¡geis\n- ExperiÃªncia com sistemas de CRM e ERP\n- AnÃ¡lise de dados e KPIs\n- GestÃ£o de projetos complexos\n\n## ğŸ¤ **COMPETÃŠNCIAS COMPORTAMENTAIS**\n- LideranÃ§a inspiradora e colaborativa\n- ComunicaÃ§Ã£o assertiva e empÃ¡tica\n- Adaptabilidade e flexibilidade\n- Pensamento estratÃ©gico\n- OrientaÃ§Ã£o para resultados\n- Trabalho em equipe multicultural\n\n## ğŸ“ˆ **OBJETIVOS E METAS**\nDiego Santos estÃ¡ focado(a) em contribuir para o crescimento sustentÃ¡vel da TechVision Solutions, aplicando sua experiÃªncia em recursos humanos e gestÃ£o de talentos para:\n- Otimizar processos e aumentar a eficiÃªncia operacional\n- Desenvolver soluÃ§Ãµes inovadoras para desafios do setor de tecnologia\n- Fortalecer a cultura organizacional e o engajamento da equipe\n- Expandir a presenÃ§a da empresa no mercado internacional\n\n---\n*Biografia gerada automaticamente pelo Virtual Company Generator v2.0.0*\n*Data: 09/11/2025*",
      "especialidade": "hr",
      "is_ceo": false
    },
    "especialista_youtube": {
      "nome_completo": "Carlos Perez",
      "primeiro_nome": "Carlos",
      "sobrenome": "Perez",
      "idade": 37,
      "genero": "masculino",
      "pais_origem": "Equador",
      "nacionalidade": "latinos",
      "role": "Especialista CriaÃ§Ã£o de ConteÃºdo e YouTube Marketing",
      "categoria": "especialistas",
      "especializacao": "CriaÃ§Ã£o de ConteÃºdo e YouTube Marketing",
      "educacao": "Bacharelado em ComunicaÃ§Ã£o Social com especializaÃ§Ã£o em Marketing Digital",
      "anos_experiencia": 15,
      "idiomas": [
        "espanhol",
        "portuguÃªs",
        "inglÃªs",
        "alemÃ£o",
        "japonÃªs"
      ],
      "biografia_md": "# ğŸ‘¤ Carlos Perez\n\n## ğŸ“‹ **INFORMAÃ‡Ã•ES BÃSICAS**\n- **Nome:** Carlos Perez\n- **Idade:** 37 anos\n- **Nacionalidade:** Equador\n- **Cargo:** Especialista CriaÃ§Ã£o de ConteÃºdo e YouTube Marketing\n- **EspecializaÃ§Ã£o:** CriaÃ§Ã£o de ConteÃºdo e YouTube Marketing\n\n## ğŸ“ **FORMAÃ‡ÃƒO ACADÃŠMICA**\nBacharelado em ComunicaÃ§Ã£o Social com especializaÃ§Ã£o em Marketing Digital\n\n## ğŸ’¼ **EXPERIÃŠNCIA PROFISSIONAL**\nCom 15 anos de experiÃªncia na Ã¡rea de criaÃ§Ã£o de conteÃºdo e youtube marketing, Carlos Perez traz uma perspectiva Ãºnica e valiosa para a TechVision Solutions. \n\nAo longo de sua carreira, ele desenvolveu competÃªncias sÃ³lidas em:\n- GestÃ£o estratÃ©gica e operacional\n- LideranÃ§a de equipes multiculturais\n- Desenvolvimento e implementaÃ§Ã£o de processos\n- AnÃ¡lise e otimizaÃ§Ã£o de resultados\n- ComunicaÃ§Ã£o executiva eficaz\n\n## ğŸŒ **COMPETÃŠNCIAS LINGUÃSTICAS**\n**Idiomas:** espanhol, portuguÃªs, inglÃªs, alemÃ£o, japonÃªs\n\n## ğŸ¯ **RESPONSABILIDADES NA TECHVISION SOLUTIONS**\nComo Especialista CriaÃ§Ã£o de ConteÃºdo e YouTube Marketing, Carlos Perez Ã© responsÃ¡vel por:\n- Suporte direto Ã s operaÃ§Ãµes estratÃ©gicas da empresa\n- CoordenaÃ§Ã£o de atividades relacionadas Ã  criaÃ§Ã£o de conteÃºdo e youtube marketing\n- ImplementaÃ§Ã£o de melhores prÃ¡ticas na Ã¡rea de tecnologia\n- ColaboraÃ§Ã£o com equipes internas e stakeholders externos\n- Desenvolvimento e execuÃ§Ã£o de iniciativas de crescimento\n\n## ğŸ’¡ **COMPETÃŠNCIAS TÃ‰CNICAS**\n- DomÃ­nio de ferramentas de gestÃ£o empresarial\n- Conhecimento avanÃ§ado em metodologias Ã¡geis\n- ExperiÃªncia com sistemas de CRM e ERP\n- AnÃ¡lise de dados e KPIs\n- GestÃ£o de projetos complexos\n\n## ğŸ¤ **COMPETÃŠNCIAS COMPORTAMENTAIS**\n- LideranÃ§a inspiradora e colaborativa\n- ComunicaÃ§Ã£o assertiva e empÃ¡tica\n- Adaptabilidade e flexibilidade\n- Pensamento estratÃ©gico\n- OrientaÃ§Ã£o para resultados\n- Trabalho em equipe multicultural\n\n## ğŸ“ˆ **OBJETIVOS E METAS**\nCarlos Perez estÃ¡ focado(a) em contribuir para o crescimento sustentÃ¡vel da TechVision Solutions, aplicando sua experiÃªncia em criaÃ§Ã£o de conteÃºdo e youtube marketing para:\n- Otimizar processos e aumentar a eficiÃªncia operacional\n- Desenvolver soluÃ§Ãµes inovadoras para desafios do setor de tecnologia\n- Fortalecer a cultura organizacional e o engajamento da equipe\n- Expandir a presenÃ§a da empresa no mercado internacional\n\n---\n*Biografia gerada automaticamente pelo Virtual Company Generator v2.0.0*\n*Data: 09/11/2025*",
      "especialidade": "youtube",
      "is_ceo": false
    },
    "especialista_midias_sociais": {
      "nome_completo": "AndrÃ© Silva",
      "primeiro_nome": "AndrÃ©",
      "sobrenome": "Silva",
      "idade": 34,
      "genero": "masculino",
      "pais_origem": "Venezuela",
      "nacionalidade": "latinos",
      "role": "Especialista Marketing Digital e MÃ­dias Sociais",
      "categoria": "especialistas",
      "especializacao": "Marketing Digital e MÃ­dias Sociais",
      "educacao": "Bacharelado em Marketing Digital e CertificaÃ§Ã£o Google Analytics",
      "anos_experiencia": 12,
      "idiomas": [
        "portuguÃªs",
        "alemÃ£o",
        "francÃªs",
        "japonÃªs"
      ],
      "biografia_md": "# ğŸ‘¤ AndrÃ© Silva\n\n## ğŸ“‹ **INFORMAÃ‡Ã•ES BÃSICAS**\n- **Nome:** AndrÃ© Silva\n- **Idade:** 34 anos\n- **Nacionalidade:** Venezuela\n- **Cargo:** Especialista Marketing Digital e MÃ­dias Sociais\n- **EspecializaÃ§Ã£o:** Marketing Digital e MÃ­dias Sociais\n\n## ğŸ“ **FORMAÃ‡ÃƒO ACADÃŠMICA**\nBacharelado em Marketing Digital e CertificaÃ§Ã£o Google Analytics\n\n## ğŸ’¼ **EXPERIÃŠNCIA PROFISSIONAL**\nCom 12 anos de experiÃªncia na Ã¡rea de marketing digital e mÃ­dias sociais, AndrÃ© Silva traz uma perspectiva Ãºnica e valiosa para a TechVision Solutions. \n\nAo longo de sua carreira, ela desenvolveu competÃªncias sÃ³lidas em:\n- GestÃ£o estratÃ©gica e operacional\n- LideranÃ§a de equipes multiculturais\n- Desenvolvimento e implementaÃ§Ã£o de processos\n- AnÃ¡lise e otimizaÃ§Ã£o de resultados\n- ComunicaÃ§Ã£o executiva eficaz\n\n## ğŸŒ **COMPETÃŠNCIAS LINGUÃSTICAS**\n**Idiomas:** portuguÃªs, alemÃ£o, francÃªs, japonÃªs\n\n## ğŸ¯ **RESPONSABILIDADES NA TECHVISION SOLUTIONS**\nComo Especialista Marketing Digital e MÃ­dias Sociais, AndrÃ© Silva Ã© responsÃ¡vel por:\n- Suporte direto Ã s operaÃ§Ãµes estratÃ©gicas da empresa\n- CoordenaÃ§Ã£o de atividades relacionadas Ã  marketing digital e mÃ­dias sociais\n- ImplementaÃ§Ã£o de melhores prÃ¡ticas na Ã¡rea de tecnologia\n- ColaboraÃ§Ã£o com equipes internas e stakeholders externos\n- Desenvolvimento e execuÃ§Ã£o de iniciativas de crescimento\n\n## ğŸ’¡ **COMPETÃŠNCIAS TÃ‰CNICAS**\n- DomÃ­nio de ferramentas de gestÃ£o empresarial\n- Conhecimento avanÃ§ado em metodologias Ã¡geis\n- ExperiÃªncia com sistemas de CRM e ERP\n- AnÃ¡lise de dados e KPIs\n- GestÃ£o de projetos complexos\n\n## ğŸ¤ **COMPETÃŠNCIAS COMPORTAMENTAIS**\n- LideranÃ§a inspiradora e colaborativa\n- ComunicaÃ§Ã£o assertiva e empÃ¡tica\n- Adaptabilidade e flexibilidade\n- Pensamento estratÃ©gico\n- OrientaÃ§Ã£o para resultados\n- Trabalho em equipe multicultural\n\n## ğŸ“ˆ **OBJETIVOS E METAS**\nAndrÃ© Silva estÃ¡ focado(a) em contribuir para o crescimento sustentÃ¡vel da TechVision Solutions, aplicando sua experiÃªncia em marketing digital e mÃ­dias sociais para:\n- Otimizar processos e aumentar a eficiÃªncia operacional\n- Desenvolver soluÃ§Ãµes inovadoras para desafios do setor de tecnologia\n- Fortalecer a cultura organizacional e o engajamento da equipe\n- Expandir a presenÃ§a da empresa no mercado internacional\n\n---\n*Biografia gerada automaticamente pelo Virtual Company Generator v2.0.0*\n*Data: 09/11/2025*",
      "especialidade": "midias_sociais",
      "is_ceo": false
    },
    "especialista_marketing": {
      "nome_completo": "Carolina Martinez",
      "primeiro_nome": "Carolina",
      "sobrenome": "Martinez",
      "idade": 38,
      "genero": "feminino",
      "pais_origem": "MÃ©xico",
      "nacionalidade": "latinos",
      "role": "Especialista Marketing EstratÃ©gico e Growth Hacking",
      "categoria": "especialistas",
      "especializacao": "Marketing EstratÃ©gico e Growth Hacking",
      "educacao": "Bacharelado em Marketing e MBA em Growth Marketing",
      "anos_experiencia": 16,
      "idiomas": [
        "espanhol",
        "japonÃªs",
        "francÃªs",
        "inglÃªs",
        "alemÃ£o"
      ],
      "biografia_md": "# ğŸ‘¤ Carolina Martinez\n\n## ğŸ“‹ **INFORMAÃ‡Ã•ES BÃSICAS**\n- **Nome:** Carolina Martinez\n- **Idade:** 38 anos\n- **Nacionalidade:** MÃ©xico\n- **Cargo:** Especialista Marketing EstratÃ©gico e Growth Hacking\n- **EspecializaÃ§Ã£o:** Marketing EstratÃ©gico e Growth Hacking\n\n## ğŸ“ **FORMAÃ‡ÃƒO ACADÃŠMICA**\nBacharelado em Marketing e MBA em Growth Marketing\n\n## ğŸ’¼ **EXPERIÃŠNCIA PROFISSIONAL**\nCom 16 anos de experiÃªncia na Ã¡rea de marketing estratÃ©gico e growth hacking, Carolina Martinez traz uma perspectiva Ãºnica e valiosa para a TechVision Solutions. \n\nAo longo de sua carreira, ela desenvolveu competÃªncias sÃ³lidas em:\n- GestÃ£o estratÃ©gica e operacional\n- LideranÃ§a de equipes multiculturais\n- Desenvolvimento e implementaÃ§Ã£o de processos\n- AnÃ¡lise e otimizaÃ§Ã£o de resultados\n- ComunicaÃ§Ã£o executiva eficaz\n\n## ğŸŒ **COMPETÃŠNCIAS LINGUÃSTICAS**\n**Idiomas:** espanhol, japonÃªs, francÃªs, inglÃªs, alemÃ£o\n\n## ğŸ¯ **RESPONSABILIDADES NA TECHVISION SOLUTIONS**\nComo Especialista Marketing EstratÃ©gico e Growth Hacking, Carolina Martinez Ã© responsÃ¡vel por:\n- Suporte direto Ã s operaÃ§Ãµes estratÃ©gicas da empresa\n- CoordenaÃ§Ã£o de atividades relacionadas Ã  marketing estratÃ©gico e growth hacking\n- ImplementaÃ§Ã£o de melhores prÃ¡ticas na Ã¡rea de tecnologia\n- ColaboraÃ§Ã£o com equipes internas e stakeholders externos\n- Desenvolvimento e execuÃ§Ã£o de iniciativas de crescimento\n\n## ğŸ’¡ **COMPETÃŠNCIAS TÃ‰CNICAS**\n- DomÃ­nio de ferramentas de gestÃ£o empresarial\n- Conhecimento avanÃ§ado em metodologias Ã¡geis\n- ExperiÃªncia com sistemas de CRM e ERP\n- AnÃ¡lise de dados e KPIs\n- GestÃ£o de projetos complexos\n\n## ğŸ¤ **COMPETÃŠNCIAS COMPORTAMENTAIS**\n- LideranÃ§a inspiradora e colaborativa\n- ComunicaÃ§Ã£o assertiva e empÃ¡tica\n- Adaptabilidade e flexibilidade\n- Pensamento estratÃ©gico\n- OrientaÃ§Ã£o para resultados\n- Trabalho em equipe multicultural\n\n## ğŸ“ˆ **OBJETIVOS E METAS**\nCarolina Martinez estÃ¡ focado(a) em contribuir para o crescimento sustentÃ¡vel da TechVision Solutions, aplicando sua experiÃªncia em marketing estratÃ©gico e growth hacking para:\n- Otimizar processos e aumentar a eficiÃªncia operacional\n- Desenvolver soluÃ§Ãµes inovadoras para desafios do setor de tecnologia\n- Fortalecer a cultura organizacional e o engajamento da equipe\n- Expandir a presenÃ§a da empresa no mercado internacional\n\n---\n*Biografia gerada automaticamente pelo Virtual Company Generator v2.0.0*\n*Data: 09/11/2025*",
      "especialidade": "marketing",
      "is_ceo": false
    },
    "especialista_financeiro": {
      "nome_completo": "Sofia Perez",
      "primeiro_nome": "Sofia",
      "sobrenome": "Perez",
      "idade": 37,
      "genero": "feminino",
      "pais_origem": "Chile",
      "nacionalidade": "latinos",
      "role": "Especialista AnÃ¡lise Financeira e Controladoria",
      "categoria": "especialistas",
      "especializacao": "AnÃ¡lise Financeira e Controladoria",
      "educacao": "Bacharelado em CiÃªncias ContÃ¡beis e CFA Charter",
      "anos_experiencia": 15,
      "idiomas": [
        "inglÃªs",
        "portuguÃªs",
        "alemÃ£o",
        "espanhol",
        "francÃªs",
        "japonÃªs"
      ],
      "biografia_md": "# ğŸ‘¤ Sofia Perez\n\n## ğŸ“‹ **INFORMAÃ‡Ã•ES BÃSICAS**\n- **Nome:** Sofia Perez\n- **Idade:** 37 anos\n- **Nacionalidade:** Chile\n- **Cargo:** Especialista AnÃ¡lise Financeira e Controladoria\n- **EspecializaÃ§Ã£o:** AnÃ¡lise Financeira e Controladoria\n\n## ğŸ“ **FORMAÃ‡ÃƒO ACADÃŠMICA**\nBacharelado em CiÃªncias ContÃ¡beis e CFA Charter\n\n## ğŸ’¼ **EXPERIÃŠNCIA PROFISSIONAL**\nCom 15 anos de experiÃªncia na Ã¡rea de anÃ¡lise financeira e controladoria, Sofia Perez traz uma perspectiva Ãºnica e valiosa para a TechVision Solutions. \n\nAo longo de sua carreira, ela desenvolveu competÃªncias sÃ³lidas em:\n- GestÃ£o estratÃ©gica e operacional\n- LideranÃ§a de equipes multiculturais\n- Desenvolvimento e implementaÃ§Ã£o de processos\n- AnÃ¡lise e otimizaÃ§Ã£o de resultados\n- ComunicaÃ§Ã£o executiva eficaz\n\n## ğŸŒ **COMPETÃŠNCIAS LINGUÃSTICAS**\n**Idiomas:** inglÃªs, portuguÃªs, alemÃ£o, espanhol, francÃªs, japonÃªs\n\n## ğŸ¯ **RESPONSABILIDADES NA TECHVISION SOLUTIONS**\nComo Especialista AnÃ¡lise Financeira e Controladoria, Sofia Perez Ã© responsÃ¡vel por:\n- Suporte direto Ã s operaÃ§Ãµes estratÃ©gicas da empresa\n- CoordenaÃ§Ã£o de atividades relacionadas Ã  anÃ¡lise financeira e controladoria\n- ImplementaÃ§Ã£o de melhores prÃ¡ticas na Ã¡rea de tecnologia\n- ColaboraÃ§Ã£o com equipes internas e stakeholders externos\n- Desenvolvimento e execuÃ§Ã£o de iniciativas de crescimento\n\n## ğŸ’¡ **COMPETÃŠNCIAS TÃ‰CNICAS**\n- DomÃ­nio de ferramentas de gestÃ£o empresarial\n- Conhecimento avanÃ§ado em metodologias Ã¡geis\n- ExperiÃªncia com sistemas de CRM e ERP\n- AnÃ¡lise de dados e KPIs\n- GestÃ£o de projetos complexos\n\n## ğŸ¤ **COMPETÃŠNCIAS COMPORTAMENTAIS**\n- LideranÃ§a inspiradora e colaborativa\n- ComunicaÃ§Ã£o assertiva e empÃ¡tica\n- Adaptabilidade e flexibilidade\n- Pensamento estratÃ©gico\n- OrientaÃ§Ã£o para resultados\n- Trabalho em equipe multicultural\n\n## ğŸ“ˆ **OBJETIVOS E METAS**\nSofia Perez estÃ¡ focado(a) em contribuir para o crescimento sustentÃ¡vel da TechVision Solutions, aplicando sua experiÃªncia em anÃ¡lise financeira e controladoria para:\n- Otimizar processos e aumentar a eficiÃªncia operacional\n- Desenvolver soluÃ§Ãµes inovadoras para desafios do setor de tecnologia\n- Fortalecer a cultura organizacional e o engajamento da equipe\n- Expandir a presenÃ§a da empresa no mercado internacional\n\n---\n*Biografia gerada automaticamente pelo Virtual Company Generator v2.0.0*\n*Data: 09/11/2025*",
      "especialidade": "financeiro",
      "is_ceo": false
    },
    "especialista_tecnologia": {
      "nome_completo": "Camila Lopez",
      "primeiro_nome": "Camila",
      "sobrenome": "Lopez",
      "idade": 37,
      "genero": "feminino",
      "pais_origem": "Equador",
      "nacionalidade": "latinos",
      "role": "Especialista Desenvolvimento de Sistemas e DevOps",
      "categoria": "especialistas",
      "especializacao": "Desenvolvimento de Sistemas e DevOps",
      "educacao": "Bacharelado em CiÃªncia da ComputaÃ§Ã£o e CertificaÃ§Ãµes AWS",
      "anos_experiencia": 15,
      "idiomas": [
        "portuguÃªs",
        "espanhol",
        "inglÃªs",
        "francÃªs",
        "japonÃªs",
        "alemÃ£o"
      ],
      "biografia_md": "# ğŸ‘¤ Camila Lopez\n\n## ğŸ“‹ **INFORMAÃ‡Ã•ES BÃSICAS**\n- **Nome:** Camila Lopez\n- **Idade:** 37 anos\n- **Nacionalidade:** Equador\n- **Cargo:** Especialista Desenvolvimento de Sistemas e DevOps\n- **EspecializaÃ§Ã£o:** Desenvolvimento de Sistemas e DevOps\n\n## ğŸ“ **FORMAÃ‡ÃƒO ACADÃŠMICA**\nBacharelado em CiÃªncia da ComputaÃ§Ã£o e CertificaÃ§Ãµes AWS\n\n## ğŸ’¼ **EXPERIÃŠNCIA PROFISSIONAL**\nCom 15 anos de experiÃªncia na Ã¡rea de desenvolvimento de sistemas e devops, Camila Lopez traz uma perspectiva Ãºnica e valiosa para a TechVision Solutions. \n\nAo longo de sua carreira, ela desenvolveu competÃªncias sÃ³lidas em:\n- GestÃ£o estratÃ©gica e operacional\n- LideranÃ§a de equipes multiculturais\n- Desenvolvimento e implementaÃ§Ã£o de processos\n- AnÃ¡lise e otimizaÃ§Ã£o de resultados\n- ComunicaÃ§Ã£o executiva eficaz\n\n## ğŸŒ **COMPETÃŠNCIAS LINGUÃSTICAS**\n**Idiomas:** portuguÃªs, espanhol, inglÃªs, francÃªs, japonÃªs, alemÃ£o\n\n## ğŸ¯ **RESPONSABILIDADES NA TECHVISION SOLUTIONS**\nComo Especialista Desenvolvimento de Sistemas e DevOps, Camila Lopez Ã© responsÃ¡vel por:\n- Suporte direto Ã s operaÃ§Ãµes estratÃ©gicas da empresa\n- CoordenaÃ§Ã£o de atividades relacionadas Ã  desenvolvimento de sistemas e devops\n- ImplementaÃ§Ã£o de melhores prÃ¡ticas na Ã¡rea de tecnologia\n- ColaboraÃ§Ã£o com equipes internas e stakeholders externos\n- Desenvolvimento e execuÃ§Ã£o de iniciativas de crescimento\n\n## ğŸ’¡ **COMPETÃŠNCIAS TÃ‰CNICAS**\n- DomÃ­nio de ferramentas de gestÃ£o empresarial\n- Conhecimento avanÃ§ado em metodologias Ã¡geis\n- ExperiÃªncia com sistemas de CRM e ERP\n- AnÃ¡lise de dados e KPIs\n- GestÃ£o de projetos complexos\n\n## ğŸ¤ **COMPETÃŠNCIAS COMPORTAMENTAIS**\n- LideranÃ§a inspiradora e colaborativa\n- ComunicaÃ§Ã£o assertiva e empÃ¡tica\n- Adaptabilidade e flexibilidade\n- Pensamento estratÃ©gico\n- OrientaÃ§Ã£o para resultados\n- Trabalho em equipe multicultural\n\n## ğŸ“ˆ **OBJETIVOS E METAS**\nCamila Lopez estÃ¡ focado(a) em contribuir para o crescimento sustentÃ¡vel da TechVision Solutions, aplicando sua experiÃªncia em desenvolvimento de sistemas e devops para:\n- Otimizar processos e aumentar a eficiÃªncia operacional\n- Desenvolver soluÃ§Ãµes inovadoras para desafios do setor de tecnologia\n- Fortalecer a cultura organizacional e o engajamento da equipe\n- Expandir a presenÃ§a da empresa no mercado internacional\n\n---\n*Biografia gerada automaticamente pelo Virtual Company Generator v2.0.0*\n*Data: 09/11/2025*",
      "especialidade": "tecnologia",
      "is_ceo": false
    }
  }
}