{
  "ceo": {
    "nome_completo": "Valentina Sanchez",
    "primeiro_nome": "Valentina",
    "sobrenome": "Sanchez",
    "idade": 46,
    "genero": "feminino",
    "pais_origem": "MÃ©xico",
    "nacionalidade": "latinos",
    "role": "CEO",
    "categoria": "executivos",
    "especializacao": "LideranÃ§a Executiva e GestÃ£o EstratÃ©gica",
    "educacao": "MBA em LideranÃ§a pela Wharton School",
    "anos_experiencia": 24,
    "idiomas": [
      "japonÃªs",
      "alemÃ£o",
      "espanhol",
      "francÃªs",
      "inglÃªs"
    ],
    "biografia_md": "# ğŸ‘¤ Valentina Sanchez\n\n## ğŸ“‹ **INFORMAÃ‡Ã•ES BÃSICAS**\n- **Nome:** Valentina Sanchez\n- **Idade:** 46 anos\n- **Nacionalidade:** MÃ©xico\n- **Cargo:** CEO\n- **EspecializaÃ§Ã£o:** LideranÃ§a Executiva e GestÃ£o EstratÃ©gica\n\n## ğŸ“ **FORMAÃ‡ÃƒO ACADÃŠMICA**\nMBA em LideranÃ§a pela Wharton School\n\n## ğŸ’¼ **EXPERIÃŠNCIA PROFISSIONAL**\nCom 24 anos de experiÃªncia na Ã¡rea de lideranÃ§a executiva e gestÃ£o estratÃ©gica, Valentina Sanchez traz uma perspectiva Ãºnica e valiosa para a TechVision Solutions. \n\nAo longo de sua carreira, ela desenvolveu competÃªncias sÃ³lidas em:\n- GestÃ£o estratÃ©gica e operacional\n- LideranÃ§a de equipes multiculturais\n- Desenvolvimento e implementaÃ§Ã£o de processos\n- AnÃ¡lise e otimizaÃ§Ã£o de resultados\n- ComunicaÃ§Ã£o executiva eficaz\n\n## ğŸŒ **COMPETÃŠNCIAS LINGUÃSTICAS**\n**Idiomas:** japonÃªs, alemÃ£o, espanhol, francÃªs, inglÃªs\n\n## ğŸ¯ **RESPONSABILIDADES NA TECHVISION SOLUTIONS**\nComo CEO, Valentina Sanchez Ã© responsÃ¡vel por:\n- Suporte direto Ã s operaÃ§Ãµes estratÃ©gicas da empresa\n- CoordenaÃ§Ã£o de atividades relacionadas Ã  lideranÃ§a executiva e gestÃ£o estratÃ©gica\n- ImplementaÃ§Ã£o de melhores prÃ¡ticas na Ã¡rea de tecnologia\n- ColaboraÃ§Ã£o com equipes internas e stakeholders externos\n- Desenvolvimento e execuÃ§Ã£o de iniciativas de crescimento\n\n## ğŸ’¡ **COMPETÃŠNCIAS TÃ‰CNICAS**\n- DomÃ­nio de ferramentas de gestÃ£o empresarial\n- Conhecimento avanÃ§ado em metodologias Ã¡geis\n- ExperiÃªncia com sistemas de CRM e ERP\n- AnÃ¡lise de dados e KPIs\n- GestÃ£o de projetos complexos\n\n## ğŸ¤ **COMPETÃŠNCIAS COMPORTAMENTAIS**\n- LideranÃ§a inspiradora e colaborativa\n- ComunicaÃ§Ã£o assertiva e empÃ¡tica\n- Adaptabilidade e flexibilidade\n- Pensamento estratÃ©gico\n- OrientaÃ§Ã£o para resultados\n- Trabalho em equipe multicultural\n\n## ğŸ“ˆ **OBJETIVOS E METAS**\nValentina Sanchez estÃ¡ focado(a) em contribuir para o crescimento sustentÃ¡vel da TechVision Solutions, aplicando sua experiÃªncia em lideranÃ§a executiva e gestÃ£o estratÃ©gica para:\n- Otimizar processos e aumentar a eficiÃªncia operacional\n- Desenvolver soluÃ§Ãµes inovadoras para desafios do setor de tecnologia\n- Fortalecer a cultura organizacional e o engajamento da equipe\n- Expandir a presenÃ§a da empresa no mercado internacional\n\n---\n*Biografia gerada automaticamente pelo Virtual Company Generator*\n*Data: 06/11/2025*",
    "especialidade": null,
    "is_ceo": true
  },
  "executivos": {
    "executivo_m_1": {
      "nome_completo": "Rafael Perez",
      "primeiro_nome": "Rafael",
      "sobrenome": "Perez",
      "idade": 44,
      "genero": "masculino",
      "pais_origem": "Chile",
      "nacionalidade": "latinos",
      "role": "Executivo",
      "categoria": "executivos",
      "especializacao": "Desenvolvimento de NegÃ³cios e EstratÃ©gia",
      "educacao": "Bacharelado em Economia pela Universidade de Stanford",
      "anos_experiencia": 22,
      "idiomas": [
        "portuguÃªs",
        "francÃªs",
        "espanhol",
        "japonÃªs",
        "alemÃ£o",
        "inglÃªs"
      ],
      "biografia_md": "# ğŸ‘¤ Rafael Perez\n\n## ğŸ“‹ **INFORMAÃ‡Ã•ES BÃSICAS**\n- **Nome:** Rafael Perez\n- **Idade:** 44 anos\n- **Nacionalidade:** Chile\n- **Cargo:** Executivo\n- **EspecializaÃ§Ã£o:** Desenvolvimento de NegÃ³cios e EstratÃ©gia\n\n## ğŸ“ **FORMAÃ‡ÃƒO ACADÃŠMICA**\nBacharelado em Economia pela Universidade de Stanford\n\n## ğŸ’¼ **EXPERIÃŠNCIA PROFISSIONAL**\nCom 22 anos de experiÃªncia na Ã¡rea de desenvolvimento de negÃ³cios e estratÃ©gia, Rafael Perez traz uma perspectiva Ãºnica e valiosa para a TechVision Solutions. \n\nAo longo de sua carreira, ela desenvolveu competÃªncias sÃ³lidas em:\n- GestÃ£o estratÃ©gica e operacional\n- LideranÃ§a de equipes multiculturais\n- Desenvolvimento e implementaÃ§Ã£o de processos\n- AnÃ¡lise e otimizaÃ§Ã£o de resultados\n- ComunicaÃ§Ã£o executiva eficaz\n\n## ğŸŒ **COMPETÃŠNCIAS LINGUÃSTICAS**\n**Idiomas:** portuguÃªs, francÃªs, espanhol, japonÃªs, alemÃ£o, inglÃªs\n\n## ğŸ¯ **RESPONSABILIDADES NA TECHVISION SOLUTIONS**\nComo Executivo, Rafael Perez Ã© responsÃ¡vel por:\n- Suporte direto Ã s operaÃ§Ãµes estratÃ©gicas da empresa\n- CoordenaÃ§Ã£o de atividades relacionadas Ã  desenvolvimento de negÃ³cios e estratÃ©gia\n- ImplementaÃ§Ã£o de melhores prÃ¡ticas na Ã¡rea de tecnologia\n- ColaboraÃ§Ã£o com equipes internas e stakeholders externos\n- Desenvolvimento e execuÃ§Ã£o de iniciativas de crescimento\n\n## ğŸ’¡ **COMPETÃŠNCIAS TÃ‰CNICAS**\n- DomÃ­nio de ferramentas de gestÃ£o empresarial\n- Conhecimento avanÃ§ado em metodologias Ã¡geis\n- ExperiÃªncia com sistemas de CRM e ERP\n- AnÃ¡lise de dados e KPIs\n- GestÃ£o de projetos complexos\n\n## ğŸ¤ **COMPETÃŠNCIAS COMPORTAMENTAIS**\n- LideranÃ§a inspiradora e colaborativa\n- ComunicaÃ§Ã£o assertiva e empÃ¡tica\n- Adaptabilidade e flexibilidade\n- Pensamento estratÃ©gico\n- OrientaÃ§Ã£o para resultados\n- Trabalho em equipe multicultural\n\n## ğŸ“ˆ **OBJETIVOS E METAS**\nRafael Perez estÃ¡ focado(a) em contribuir para o crescimento sustentÃ¡vel da TechVision Solutions, aplicando sua experiÃªncia em desenvolvimento de negÃ³cios e estratÃ©gia para:\n- Otimizar processos e aumentar a eficiÃªncia operacional\n- Desenvolver soluÃ§Ãµes inovadoras para desafios do setor de tecnologia\n- Fortalecer a cultura organizacional e o engajamento da equipe\n- Expandir a presenÃ§a da empresa no mercado internacional\n\n---\n*Biografia gerada automaticamente pelo Virtual Company Generator*\n*Data: 06/11/2025*",
      "especialidade": null,
      "is_ceo": false
    },
    "executivo_m_2": {
      "nome_completo": "Mateo Martinez",
      "primeiro_nome": "Mateo",
      "sobrenome": "Martinez",
      "idade": 36,
      "genero": "masculino",
      "pais_origem": "Chile",
      "nacionalidade": "latinos",
      "role": "Executivo",
      "categoria": "executivos",
      "especializacao": "GestÃ£o de OperaÃ§Ãµes e Processos",
      "educacao": "MBA em LideranÃ§a pela Wharton School",
      "anos_experiencia": 14,
      "idiomas": [
        "portuguÃªs",
        "francÃªs",
        "espanhol",
        "japonÃªs",
        "inglÃªs",
        "alemÃ£o"
      ],
      "biografia_md": "# ğŸ‘¤ Mateo Martinez\n\n## ğŸ“‹ **INFORMAÃ‡Ã•ES BÃSICAS**\n- **Nome:** Mateo Martinez\n- **Idade:** 36 anos\n- **Nacionalidade:** Chile\n- **Cargo:** Executivo\n- **EspecializaÃ§Ã£o:** GestÃ£o de OperaÃ§Ãµes e Processos\n\n## ğŸ“ **FORMAÃ‡ÃƒO ACADÃŠMICA**\nMBA em LideranÃ§a pela Wharton School\n\n## ğŸ’¼ **EXPERIÃŠNCIA PROFISSIONAL**\nCom 14 anos de experiÃªncia na Ã¡rea de gestÃ£o de operaÃ§Ãµes e processos, Mateo Martinez traz uma perspectiva Ãºnica e valiosa para a TechVision Solutions. \n\nAo longo de sua carreira, ela desenvolveu competÃªncias sÃ³lidas em:\n- GestÃ£o estratÃ©gica e operacional\n- LideranÃ§a de equipes multiculturais\n- Desenvolvimento e implementaÃ§Ã£o de processos\n- AnÃ¡lise e otimizaÃ§Ã£o de resultados\n- ComunicaÃ§Ã£o executiva eficaz\n\n## ğŸŒ **COMPETÃŠNCIAS LINGUÃSTICAS**\n**Idiomas:** portuguÃªs, francÃªs, espanhol, japonÃªs, inglÃªs, alemÃ£o\n\n## ğŸ¯ **RESPONSABILIDADES NA TECHVISION SOLUTIONS**\nComo Executivo, Mateo Martinez Ã© responsÃ¡vel por:\n- Suporte direto Ã s operaÃ§Ãµes estratÃ©gicas da empresa\n- CoordenaÃ§Ã£o de atividades relacionadas Ã  gestÃ£o de operaÃ§Ãµes e processos\n- ImplementaÃ§Ã£o de melhores prÃ¡ticas na Ã¡rea de tecnologia\n- ColaboraÃ§Ã£o com equipes internas e stakeholders externos\n- Desenvolvimento e execuÃ§Ã£o de iniciativas de crescimento\n\n## ğŸ’¡ **COMPETÃŠNCIAS TÃ‰CNICAS**\n- DomÃ­nio de ferramentas de gestÃ£o empresarial\n- Conhecimento avanÃ§ado em metodologias Ã¡geis\n- ExperiÃªncia com sistemas de CRM e ERP\n- AnÃ¡lise de dados e KPIs\n- GestÃ£o de projetos complexos\n\n## ğŸ¤ **COMPETÃŠNCIAS COMPORTAMENTAIS**\n- LideranÃ§a inspiradora e colaborativa\n- ComunicaÃ§Ã£o assertiva e empÃ¡tica\n- Adaptabilidade e flexibilidade\n- Pensamento estratÃ©gico\n- OrientaÃ§Ã£o para resultados\n- Trabalho em equipe multicultural\n\n## ğŸ“ˆ **OBJETIVOS E METAS**\nMateo Martinez estÃ¡ focado(a) em contribuir para o crescimento sustentÃ¡vel da TechVision Solutions, aplicando sua experiÃªncia em gestÃ£o de operaÃ§Ãµes e processos para:\n- Otimizar processos e aumentar a eficiÃªncia operacional\n- Desenvolver soluÃ§Ãµes inovadoras para desafios do setor de tecnologia\n- Fortalecer a cultura organizacional e o engajamento da equipe\n- Expandir a presenÃ§a da empresa no mercado internacional\n\n---\n*Biografia gerada automaticamente pelo Virtual Company Generator*\n*Data: 06/11/2025*",
      "especialidade": null,
      "is_ceo": false
    },
    "executiva_f_1": {
      "nome_completo": "Sofia Sanchez",
      "primeiro_nome": "Sofia",
      "sobrenome": "Sanchez",
      "idade": 42,
      "genero": "feminino",
      "pais_origem": "ColÃ´mbia",
      "nacionalidade": "latinos",
      "role": "Executiva",
      "categoria": "executivos",
      "especializacao": "Desenvolvimento de NegÃ³cios e EstratÃ©gia",
      "educacao": "Mestrado em GestÃ£o EstratÃ©gica pela INSEAD",
      "anos_experiencia": 20,
      "idiomas": [
        "japonÃªs",
        "espanhol",
        "francÃªs",
        "portuguÃªs"
      ],
      "biografia_md": "# ğŸ‘¤ Sofia Sanchez\n\n## ğŸ“‹ **INFORMAÃ‡Ã•ES BÃSICAS**\n- **Nome:** Sofia Sanchez\n- **Idade:** 42 anos\n- **Nacionalidade:** ColÃ´mbia\n- **Cargo:** Executiva\n- **EspecializaÃ§Ã£o:** Desenvolvimento de NegÃ³cios e EstratÃ©gia\n\n## ğŸ“ **FORMAÃ‡ÃƒO ACADÃŠMICA**\nMestrado em GestÃ£o EstratÃ©gica pela INSEAD\n\n## ğŸ’¼ **EXPERIÃŠNCIA PROFISSIONAL**\nCom 20 anos de experiÃªncia na Ã¡rea de desenvolvimento de negÃ³cios e estratÃ©gia, Sofia Sanchez traz uma perspectiva Ãºnica e valiosa para a TechVision Solutions. \n\nAo longo de sua carreira, ela desenvolveu competÃªncias sÃ³lidas em:\n- GestÃ£o estratÃ©gica e operacional\n- LideranÃ§a de equipes multiculturais\n- Desenvolvimento e implementaÃ§Ã£o de processos\n- AnÃ¡lise e otimizaÃ§Ã£o de resultados\n- ComunicaÃ§Ã£o executiva eficaz\n\n## ğŸŒ **COMPETÃŠNCIAS LINGUÃSTICAS**\n**Idiomas:** japonÃªs, espanhol, francÃªs, portuguÃªs\n\n## ğŸ¯ **RESPONSABILIDADES NA TECHVISION SOLUTIONS**\nComo Executiva, Sofia Sanchez Ã© responsÃ¡vel por:\n- Suporte direto Ã s operaÃ§Ãµes estratÃ©gicas da empresa\n- CoordenaÃ§Ã£o de atividades relacionadas Ã  desenvolvimento de negÃ³cios e estratÃ©gia\n- ImplementaÃ§Ã£o de melhores prÃ¡ticas na Ã¡rea de tecnologia\n- ColaboraÃ§Ã£o com equipes internas e stakeholders externos\n- Desenvolvimento e execuÃ§Ã£o de iniciativas de crescimento\n\n## ğŸ’¡ **COMPETÃŠNCIAS TÃ‰CNICAS**\n- DomÃ­nio de ferramentas de gestÃ£o empresarial\n- Conhecimento avanÃ§ado em metodologias Ã¡geis\n- ExperiÃªncia com sistemas de CRM e ERP\n- AnÃ¡lise de dados e KPIs\n- GestÃ£o de projetos complexos\n\n## ğŸ¤ **COMPETÃŠNCIAS COMPORTAMENTAIS**\n- LideranÃ§a inspiradora e colaborativa\n- ComunicaÃ§Ã£o assertiva e empÃ¡tica\n- Adaptabilidade e flexibilidade\n- Pensamento estratÃ©gico\n- OrientaÃ§Ã£o para resultados\n- Trabalho em equipe multicultural\n\n## ğŸ“ˆ **OBJETIVOS E METAS**\nSofia Sanchez estÃ¡ focado(a) em contribuir para o crescimento sustentÃ¡vel da TechVision Solutions, aplicando sua experiÃªncia em desenvolvimento de negÃ³cios e estratÃ©gia para:\n- Otimizar processos e aumentar a eficiÃªncia operacional\n- Desenvolver soluÃ§Ãµes inovadoras para desafios do setor de tecnologia\n- Fortalecer a cultura organizacional e o engajamento da equipe\n- Expandir a presenÃ§a da empresa no mercado internacional\n\n---\n*Biografia gerada automaticamente pelo Virtual Company Generator*\n*Data: 06/11/2025*",
      "especialidade": null,
      "is_ceo": false
    },
    "executiva_f_2": {
      "nome_completo": "Carmen Perez",
      "primeiro_nome": "Carmen",
      "sobrenome": "Perez",
      "idade": 42,
      "genero": "feminino",
      "pais_origem": "Brasil",
      "nacionalidade": "latinos",
      "role": "Executiva",
      "categoria": "executivos",
      "especializacao": "GestÃ£o de OperaÃ§Ãµes e Processos",
      "educacao": "Bacharelado em Economia pela Universidade de Stanford",
      "anos_experiencia": 20,
      "idiomas": [
        "espanhol",
        "portuguÃªs",
        "inglÃªs"
      ],
      "biografia_md": "# ğŸ‘¤ Carmen Perez\n\n## ğŸ“‹ **INFORMAÃ‡Ã•ES BÃSICAS**\n- **Nome:** Carmen Perez\n- **Idade:** 42 anos\n- **Nacionalidade:** Brasil\n- **Cargo:** Executiva\n- **EspecializaÃ§Ã£o:** GestÃ£o de OperaÃ§Ãµes e Processos\n\n## ğŸ“ **FORMAÃ‡ÃƒO ACADÃŠMICA**\nBacharelado em Economia pela Universidade de Stanford\n\n## ğŸ’¼ **EXPERIÃŠNCIA PROFISSIONAL**\nCom 20 anos de experiÃªncia na Ã¡rea de gestÃ£o de operaÃ§Ãµes e processos, Carmen Perez traz uma perspectiva Ãºnica e valiosa para a TechVision Solutions. \n\nAo longo de sua carreira, ela desenvolveu competÃªncias sÃ³lidas em:\n- GestÃ£o estratÃ©gica e operacional\n- LideranÃ§a de equipes multiculturais\n- Desenvolvimento e implementaÃ§Ã£o de processos\n- AnÃ¡lise e otimizaÃ§Ã£o de resultados\n- ComunicaÃ§Ã£o executiva eficaz\n\n## ğŸŒ **COMPETÃŠNCIAS LINGUÃSTICAS**\n**Idiomas:** espanhol, portuguÃªs, inglÃªs\n\n## ğŸ¯ **RESPONSABILIDADES NA TECHVISION SOLUTIONS**\nComo Executiva, Carmen Perez Ã© responsÃ¡vel por:\n- Suporte direto Ã s operaÃ§Ãµes estratÃ©gicas da empresa\n- CoordenaÃ§Ã£o de atividades relacionadas Ã  gestÃ£o de operaÃ§Ãµes e processos\n- ImplementaÃ§Ã£o de melhores prÃ¡ticas na Ã¡rea de tecnologia\n- ColaboraÃ§Ã£o com equipes internas e stakeholders externos\n- Desenvolvimento e execuÃ§Ã£o de iniciativas de crescimento\n\n## ğŸ’¡ **COMPETÃŠNCIAS TÃ‰CNICAS**\n- DomÃ­nio de ferramentas de gestÃ£o empresarial\n- Conhecimento avanÃ§ado em metodologias Ã¡geis\n- ExperiÃªncia com sistemas de CRM e ERP\n- AnÃ¡lise de dados e KPIs\n- GestÃ£o de projetos complexos\n\n## ğŸ¤ **COMPETÃŠNCIAS COMPORTAMENTAIS**\n- LideranÃ§a inspiradora e colaborativa\n- ComunicaÃ§Ã£o assertiva e empÃ¡tica\n- Adaptabilidade e flexibilidade\n- Pensamento estratÃ©gico\n- OrientaÃ§Ã£o para resultados\n- Trabalho em equipe multicultural\n\n## ğŸ“ˆ **OBJETIVOS E METAS**\nCarmen Perez estÃ¡ focado(a) em contribuir para o crescimento sustentÃ¡vel da TechVision Solutions, aplicando sua experiÃªncia em gestÃ£o de operaÃ§Ãµes e processos para:\n- Otimizar processos e aumentar a eficiÃªncia operacional\n- Desenvolver soluÃ§Ãµes inovadoras para desafios do setor de tecnologia\n- Fortalecer a cultura organizacional e o engajamento da equipe\n- Expandir a presenÃ§a da empresa no mercado internacional\n\n---\n*Biografia gerada automaticamente pelo Virtual Company Generator*\n*Data: 06/11/2025*",
      "especialidade": null,
      "is_ceo": false
    }
  },
  "assistentes": {
    "assistente_m_1": {
      "nome_completo": "Mateo Silva",
      "primeiro_nome": "Mateo",
      "sobrenome": "Silva",
      "idade": 32,
      "genero": "masculino",
      "pais_origem": "Chile",
      "nacionalidade": "latinos",
      "role": "Assistente Executivo",
      "categoria": "assistentes",
      "especializacao": "Suporte Executivo e GestÃ£o Administrativa",
      "educacao": "Bacharelado em ComunicaÃ§Ã£o Social",
      "anos_experiencia": 10,
      "idiomas": [
        "japonÃªs",
        "francÃªs",
        "espanhol",
        "portuguÃªs"
      ],
      "biografia_md": "# ğŸ‘¤ Mateo Silva\n\n## ğŸ“‹ **INFORMAÃ‡Ã•ES BÃSICAS**\n- **Nome:** Mateo Silva\n- **Idade:** 32 anos\n- **Nacionalidade:** Chile\n- **Cargo:** Assistente Executivo\n- **EspecializaÃ§Ã£o:** Suporte Executivo e GestÃ£o Administrativa\n\n## ğŸ“ **FORMAÃ‡ÃƒO ACADÃŠMICA**\nBacharelado em ComunicaÃ§Ã£o Social\n\n## ğŸ’¼ **EXPERIÃŠNCIA PROFISSIONAL**\nCom 10 anos de experiÃªncia na Ã¡rea de suporte executivo e gestÃ£o administrativa, Mateo Silva traz uma perspectiva Ãºnica e valiosa para a TechVision Solutions. \n\nAo longo de sua carreira, ela desenvolveu competÃªncias sÃ³lidas em:\n- GestÃ£o estratÃ©gica e operacional\n- LideranÃ§a de equipes multiculturais\n- Desenvolvimento e implementaÃ§Ã£o de processos\n- AnÃ¡lise e otimizaÃ§Ã£o de resultados\n- ComunicaÃ§Ã£o executiva eficaz\n\n## ğŸŒ **COMPETÃŠNCIAS LINGUÃSTICAS**\n**Idiomas:** japonÃªs, francÃªs, espanhol, portuguÃªs\n\n## ğŸ¯ **RESPONSABILIDADES NA TECHVISION SOLUTIONS**\nComo Assistente Executivo, Mateo Silva Ã© responsÃ¡vel por:\n- Suporte direto Ã s operaÃ§Ãµes estratÃ©gicas da empresa\n- CoordenaÃ§Ã£o de atividades relacionadas Ã  suporte executivo e gestÃ£o administrativa\n- ImplementaÃ§Ã£o de melhores prÃ¡ticas na Ã¡rea de tecnologia\n- ColaboraÃ§Ã£o com equipes internas e stakeholders externos\n- Desenvolvimento e execuÃ§Ã£o de iniciativas de crescimento\n\n## ğŸ’¡ **COMPETÃŠNCIAS TÃ‰CNICAS**\n- DomÃ­nio de ferramentas de gestÃ£o empresarial\n- Conhecimento avanÃ§ado em metodologias Ã¡geis\n- ExperiÃªncia com sistemas de CRM e ERP\n- AnÃ¡lise de dados e KPIs\n- GestÃ£o de projetos complexos\n\n## ğŸ¤ **COMPETÃŠNCIAS COMPORTAMENTAIS**\n- LideranÃ§a inspiradora e colaborativa\n- ComunicaÃ§Ã£o assertiva e empÃ¡tica\n- Adaptabilidade e flexibilidade\n- Pensamento estratÃ©gico\n- OrientaÃ§Ã£o para resultados\n- Trabalho em equipe multicultural\n\n## ğŸ“ˆ **OBJETIVOS E METAS**\nMateo Silva estÃ¡ focado(a) em contribuir para o crescimento sustentÃ¡vel da TechVision Solutions, aplicando sua experiÃªncia em suporte executivo e gestÃ£o administrativa para:\n- Otimizar processos e aumentar a eficiÃªncia operacional\n- Desenvolver soluÃ§Ãµes inovadoras para desafios do setor de tecnologia\n- Fortalecer a cultura organizacional e o engajamento da equipe\n- Expandir a presenÃ§a da empresa no mercado internacional\n\n---\n*Biografia gerada automaticamente pelo Virtual Company Generator*\n*Data: 06/11/2025*",
      "especialidade": null,
      "is_ceo": false
    },
    "assistente_m_2": {
      "nome_completo": "JoÃ£o Silva",
      "primeiro_nome": "JoÃ£o",
      "sobrenome": "Silva",
      "idade": 34,
      "genero": "masculino",
      "pais_origem": "Peru",
      "nacionalidade": "latinos",
      "role": "Assistente Executivo",
      "categoria": "assistentes",
      "especializacao": "Suporte Executivo e GestÃ£o Administrativa",
      "educacao": "Bacharelado em ComunicaÃ§Ã£o Social",
      "anos_experiencia": 12,
      "idiomas": [
        "portuguÃªs",
        "espanhol",
        "inglÃªs"
      ],
      "biografia_md": "# ğŸ‘¤ JoÃ£o Silva\n\n## ğŸ“‹ **INFORMAÃ‡Ã•ES BÃSICAS**\n- **Nome:** JoÃ£o Silva\n- **Idade:** 34 anos\n- **Nacionalidade:** Peru\n- **Cargo:** Assistente Executivo\n- **EspecializaÃ§Ã£o:** Suporte Executivo e GestÃ£o Administrativa\n\n## ğŸ“ **FORMAÃ‡ÃƒO ACADÃŠMICA**\nBacharelado em ComunicaÃ§Ã£o Social\n\n## ğŸ’¼ **EXPERIÃŠNCIA PROFISSIONAL**\nCom 12 anos de experiÃªncia na Ã¡rea de suporte executivo e gestÃ£o administrativa, JoÃ£o Silva traz uma perspectiva Ãºnica e valiosa para a TechVision Solutions. \n\nAo longo de sua carreira, ele desenvolveu competÃªncias sÃ³lidas em:\n- GestÃ£o estratÃ©gica e operacional\n- LideranÃ§a de equipes multiculturais\n- Desenvolvimento e implementaÃ§Ã£o de processos\n- AnÃ¡lise e otimizaÃ§Ã£o de resultados\n- ComunicaÃ§Ã£o executiva eficaz\n\n## ğŸŒ **COMPETÃŠNCIAS LINGUÃSTICAS**\n**Idiomas:** portuguÃªs, espanhol, inglÃªs\n\n## ğŸ¯ **RESPONSABILIDADES NA TECHVISION SOLUTIONS**\nComo Assistente Executivo, JoÃ£o Silva Ã© responsÃ¡vel por:\n- Suporte direto Ã s operaÃ§Ãµes estratÃ©gicas da empresa\n- CoordenaÃ§Ã£o de atividades relacionadas Ã  suporte executivo e gestÃ£o administrativa\n- ImplementaÃ§Ã£o de melhores prÃ¡ticas na Ã¡rea de tecnologia\n- ColaboraÃ§Ã£o com equipes internas e stakeholders externos\n- Desenvolvimento e execuÃ§Ã£o de iniciativas de crescimento\n\n## ğŸ’¡ **COMPETÃŠNCIAS TÃ‰CNICAS**\n- DomÃ­nio de ferramentas de gestÃ£o empresarial\n- Conhecimento avanÃ§ado em metodologias Ã¡geis\n- ExperiÃªncia com sistemas de CRM e ERP\n- AnÃ¡lise de dados e KPIs\n- GestÃ£o de projetos complexos\n\n## ğŸ¤ **COMPETÃŠNCIAS COMPORTAMENTAIS**\n- LideranÃ§a inspiradora e colaborativa\n- ComunicaÃ§Ã£o assertiva e empÃ¡tica\n- Adaptabilidade e flexibilidade\n- Pensamento estratÃ©gico\n- OrientaÃ§Ã£o para resultados\n- Trabalho em equipe multicultural\n\n## ğŸ“ˆ **OBJETIVOS E METAS**\nJoÃ£o Silva estÃ¡ focado(a) em contribuir para o crescimento sustentÃ¡vel da TechVision Solutions, aplicando sua experiÃªncia em suporte executivo e gestÃ£o administrativa para:\n- Otimizar processos e aumentar a eficiÃªncia operacional\n- Desenvolver soluÃ§Ãµes inovadoras para desafios do setor de tecnologia\n- Fortalecer a cultura organizacional e o engajamento da equipe\n- Expandir a presenÃ§a da empresa no mercado internacional\n\n---\n*Biografia gerada automaticamente pelo Virtual Company Generator*\n*Data: 06/11/2025*",
      "especialidade": null,
      "is_ceo": false
    },
    "assistente_f_1": {
      "nome_completo": "Lucia Silva",
      "primeiro_nome": "Lucia",
      "sobrenome": "Silva",
      "idade": 35,
      "genero": "feminino",
      "pais_origem": "Venezuela",
      "nacionalidade": "latinos",
      "role": "Assistente Executiva",
      "categoria": "assistentes",
      "especializacao": "Suporte Executivo e GestÃ£o Administrativa",
      "educacao": "Bacharelado em AdministraÃ§Ã£o de Empresas",
      "anos_experiencia": 13,
      "idiomas": [
        "espanhol",
        "japonÃªs",
        "portuguÃªs"
      ],
      "biografia_md": "# ğŸ‘¤ Lucia Silva\n\n## ğŸ“‹ **INFORMAÃ‡Ã•ES BÃSICAS**\n- **Nome:** Lucia Silva\n- **Idade:** 35 anos\n- **Nacionalidade:** Venezuela\n- **Cargo:** Assistente Executiva\n- **EspecializaÃ§Ã£o:** Suporte Executivo e GestÃ£o Administrativa\n\n## ğŸ“ **FORMAÃ‡ÃƒO ACADÃŠMICA**\nBacharelado em AdministraÃ§Ã£o de Empresas\n\n## ğŸ’¼ **EXPERIÃŠNCIA PROFISSIONAL**\nCom 13 anos de experiÃªncia na Ã¡rea de suporte executivo e gestÃ£o administrativa, Lucia Silva traz uma perspectiva Ãºnica e valiosa para a TechVision Solutions. \n\nAo longo de sua carreira, ela desenvolveu competÃªncias sÃ³lidas em:\n- GestÃ£o estratÃ©gica e operacional\n- LideranÃ§a de equipes multiculturais\n- Desenvolvimento e implementaÃ§Ã£o de processos\n- AnÃ¡lise e otimizaÃ§Ã£o de resultados\n- ComunicaÃ§Ã£o executiva eficaz\n\n## ğŸŒ **COMPETÃŠNCIAS LINGUÃSTICAS**\n**Idiomas:** espanhol, japonÃªs, portuguÃªs\n\n## ğŸ¯ **RESPONSABILIDADES NA TECHVISION SOLUTIONS**\nComo Assistente Executiva, Lucia Silva Ã© responsÃ¡vel por:\n- Suporte direto Ã s operaÃ§Ãµes estratÃ©gicas da empresa\n- CoordenaÃ§Ã£o de atividades relacionadas Ã  suporte executivo e gestÃ£o administrativa\n- ImplementaÃ§Ã£o de melhores prÃ¡ticas na Ã¡rea de tecnologia\n- ColaboraÃ§Ã£o com equipes internas e stakeholders externos\n- Desenvolvimento e execuÃ§Ã£o de iniciativas de crescimento\n\n## ğŸ’¡ **COMPETÃŠNCIAS TÃ‰CNICAS**\n- DomÃ­nio de ferramentas de gestÃ£o empresarial\n- Conhecimento avanÃ§ado em metodologias Ã¡geis\n- ExperiÃªncia com sistemas de CRM e ERP\n- AnÃ¡lise de dados e KPIs\n- GestÃ£o de projetos complexos\n\n## ğŸ¤ **COMPETÃŠNCIAS COMPORTAMENTAIS**\n- LideranÃ§a inspiradora e colaborativa\n- ComunicaÃ§Ã£o assertiva e empÃ¡tica\n- Adaptabilidade e flexibilidade\n- Pensamento estratÃ©gico\n- OrientaÃ§Ã£o para resultados\n- Trabalho em equipe multicultural\n\n## ğŸ“ˆ **OBJETIVOS E METAS**\nLucia Silva estÃ¡ focado(a) em contribuir para o crescimento sustentÃ¡vel da TechVision Solutions, aplicando sua experiÃªncia em suporte executivo e gestÃ£o administrativa para:\n- Otimizar processos e aumentar a eficiÃªncia operacional\n- Desenvolver soluÃ§Ãµes inovadoras para desafios do setor de tecnologia\n- Fortalecer a cultura organizacional e o engajamento da equipe\n- Expandir a presenÃ§a da empresa no mercado internacional\n\n---\n*Biografia gerada automaticamente pelo Virtual Company Generator*\n*Data: 06/11/2025*",
      "especialidade": null,
      "is_ceo": false
    },
    "assistente_f_2": {
      "nome_completo": "Valentina Gonzalez",
      "primeiro_nome": "Valentina",
      "sobrenome": "Gonzalez",
      "idade": 31,
      "genero": "feminino",
      "pais_origem": "Chile",
      "nacionalidade": "latinos",
      "role": "Assistente Executiva",
      "categoria": "assistentes",
      "especializacao": "Suporte Executivo e GestÃ£o Administrativa",
      "educacao": "Bacharelado em ComunicaÃ§Ã£o Social",
      "anos_experiencia": 9,
      "idiomas": [
        "francÃªs",
        "inglÃªs",
        "espanhol",
        "japonÃªs",
        "alemÃ£o",
        "portuguÃªs"
      ],
      "biografia_md": "# ğŸ‘¤ Valentina Gonzalez\n\n## ğŸ“‹ **INFORMAÃ‡Ã•ES BÃSICAS**\n- **Nome:** Valentina Gonzalez\n- **Idade:** 31 anos\n- **Nacionalidade:** Chile\n- **Cargo:** Assistente Executiva\n- **EspecializaÃ§Ã£o:** Suporte Executivo e GestÃ£o Administrativa\n\n## ğŸ“ **FORMAÃ‡ÃƒO ACADÃŠMICA**\nBacharelado em ComunicaÃ§Ã£o Social\n\n## ğŸ’¼ **EXPERIÃŠNCIA PROFISSIONAL**\nCom 9 anos de experiÃªncia na Ã¡rea de suporte executivo e gestÃ£o administrativa, Valentina Gonzalez traz uma perspectiva Ãºnica e valiosa para a TechVision Solutions. \n\nAo longo de sua carreira, ela desenvolveu competÃªncias sÃ³lidas em:\n- GestÃ£o estratÃ©gica e operacional\n- LideranÃ§a de equipes multiculturais\n- Desenvolvimento e implementaÃ§Ã£o de processos\n- AnÃ¡lise e otimizaÃ§Ã£o de resultados\n- ComunicaÃ§Ã£o executiva eficaz\n\n## ğŸŒ **COMPETÃŠNCIAS LINGUÃSTICAS**\n**Idiomas:** francÃªs, inglÃªs, espanhol, japonÃªs, alemÃ£o, portuguÃªs\n\n## ğŸ¯ **RESPONSABILIDADES NA TECHVISION SOLUTIONS**\nComo Assistente Executiva, Valentina Gonzalez Ã© responsÃ¡vel por:\n- Suporte direto Ã s operaÃ§Ãµes estratÃ©gicas da empresa\n- CoordenaÃ§Ã£o de atividades relacionadas Ã  suporte executivo e gestÃ£o administrativa\n- ImplementaÃ§Ã£o de melhores prÃ¡ticas na Ã¡rea de tecnologia\n- ColaboraÃ§Ã£o com equipes internas e stakeholders externos\n- Desenvolvimento e execuÃ§Ã£o de iniciativas de crescimento\n\n## ğŸ’¡ **COMPETÃŠNCIAS TÃ‰CNICAS**\n- DomÃ­nio de ferramentas de gestÃ£o empresarial\n- Conhecimento avanÃ§ado em metodologias Ã¡geis\n- ExperiÃªncia com sistemas de CRM e ERP\n- AnÃ¡lise de dados e KPIs\n- GestÃ£o de projetos complexos\n\n## ğŸ¤ **COMPETÃŠNCIAS COMPORTAMENTAIS**\n- LideranÃ§a inspiradora e colaborativa\n- ComunicaÃ§Ã£o assertiva e empÃ¡tica\n- Adaptabilidade e flexibilidade\n- Pensamento estratÃ©gico\n- OrientaÃ§Ã£o para resultados\n- Trabalho em equipe multicultural\n\n## ğŸ“ˆ **OBJETIVOS E METAS**\nValentina Gonzalez estÃ¡ focado(a) em contribuir para o crescimento sustentÃ¡vel da TechVision Solutions, aplicando sua experiÃªncia em suporte executivo e gestÃ£o administrativa para:\n- Otimizar processos e aumentar a eficiÃªncia operacional\n- Desenvolver soluÃ§Ãµes inovadoras para desafios do setor de tecnologia\n- Fortalecer a cultura organizacional e o engajamento da equipe\n- Expandir a presenÃ§a da empresa no mercado internacional\n\n---\n*Biografia gerada automaticamente pelo Virtual Company Generator*\n*Data: 06/11/2025*",
      "especialidade": null,
      "is_ceo": false
    },
    "assistente_f_3": {
      "nome_completo": "Carmen Sanchez",
      "primeiro_nome": "Carmen",
      "sobrenome": "Sanchez",
      "idade": 31,
      "genero": "feminino",
      "pais_origem": "Argentina",
      "nacionalidade": "latinos",
      "role": "Assistente Executiva",
      "categoria": "assistentes",
      "especializacao": "Suporte Executivo e GestÃ£o Administrativa",
      "educacao": "TecnÃ³logo em GestÃ£o Comercial",
      "anos_experiencia": 9,
      "idiomas": [
        "espanhol",
        "portuguÃªs",
        "japonÃªs",
        "francÃªs",
        "inglÃªs"
      ],
      "biografia_md": "# ğŸ‘¤ Carmen Sanchez\n\n## ğŸ“‹ **INFORMAÃ‡Ã•ES BÃSICAS**\n- **Nome:** Carmen Sanchez\n- **Idade:** 31 anos\n- **Nacionalidade:** Argentina\n- **Cargo:** Assistente Executiva\n- **EspecializaÃ§Ã£o:** Suporte Executivo e GestÃ£o Administrativa\n\n## ğŸ“ **FORMAÃ‡ÃƒO ACADÃŠMICA**\nTecnÃ³logo em GestÃ£o Comercial\n\n## ğŸ’¼ **EXPERIÃŠNCIA PROFISSIONAL**\nCom 9 anos de experiÃªncia na Ã¡rea de suporte executivo e gestÃ£o administrativa, Carmen Sanchez traz uma perspectiva Ãºnica e valiosa para a TechVision Solutions. \n\nAo longo de sua carreira, ela desenvolveu competÃªncias sÃ³lidas em:\n- GestÃ£o estratÃ©gica e operacional\n- LideranÃ§a de equipes multiculturais\n- Desenvolvimento e implementaÃ§Ã£o de processos\n- AnÃ¡lise e otimizaÃ§Ã£o de resultados\n- ComunicaÃ§Ã£o executiva eficaz\n\n## ğŸŒ **COMPETÃŠNCIAS LINGUÃSTICAS**\n**Idiomas:** espanhol, portuguÃªs, japonÃªs, francÃªs, inglÃªs\n\n## ğŸ¯ **RESPONSABILIDADES NA TECHVISION SOLUTIONS**\nComo Assistente Executiva, Carmen Sanchez Ã© responsÃ¡vel por:\n- Suporte direto Ã s operaÃ§Ãµes estratÃ©gicas da empresa\n- CoordenaÃ§Ã£o de atividades relacionadas Ã  suporte executivo e gestÃ£o administrativa\n- ImplementaÃ§Ã£o de melhores prÃ¡ticas na Ã¡rea de tecnologia\n- ColaboraÃ§Ã£o com equipes internas e stakeholders externos\n- Desenvolvimento e execuÃ§Ã£o de iniciativas de crescimento\n\n## ğŸ’¡ **COMPETÃŠNCIAS TÃ‰CNICAS**\n- DomÃ­nio de ferramentas de gestÃ£o empresarial\n- Conhecimento avanÃ§ado em metodologias Ã¡geis\n- ExperiÃªncia com sistemas de CRM e ERP\n- AnÃ¡lise de dados e KPIs\n- GestÃ£o de projetos complexos\n\n## ğŸ¤ **COMPETÃŠNCIAS COMPORTAMENTAIS**\n- LideranÃ§a inspiradora e colaborativa\n- ComunicaÃ§Ã£o assertiva e empÃ¡tica\n- Adaptabilidade e flexibilidade\n- Pensamento estratÃ©gico\n- OrientaÃ§Ã£o para resultados\n- Trabalho em equipe multicultural\n\n## ğŸ“ˆ **OBJETIVOS E METAS**\nCarmen Sanchez estÃ¡ focado(a) em contribuir para o crescimento sustentÃ¡vel da TechVision Solutions, aplicando sua experiÃªncia em suporte executivo e gestÃ£o administrativa para:\n- Otimizar processos e aumentar a eficiÃªncia operacional\n- Desenvolver soluÃ§Ãµes inovadoras para desafios do setor de tecnologia\n- Fortalecer a cultura organizacional e o engajamento da equipe\n- Expandir a presenÃ§a da empresa no mercado internacional\n\n---\n*Biografia gerada automaticamente pelo Virtual Company Generator*\n*Data: 06/11/2025*",
      "especialidade": null,
      "is_ceo": false
    }
  },
  "especialistas": {
    "especialista_hr": {
      "nome_completo": "Luis Sanchez",
      "primeiro_nome": "Luis",
      "sobrenome": "Sanchez",
      "idade": 35,
      "genero": "masculino",
      "pais_origem": "Peru",
      "nacionalidade": "latinos",
      "role": "Especialista Recursos Humanos e GestÃ£o de Talentos",
      "categoria": "especialistas",
      "especializacao": "Recursos Humanos e GestÃ£o de Talentos",
      "educacao": "Bacharelado em Psicologia Organizacional e MBA em GestÃ£o de Pessoas",
      "anos_experiencia": 13,
      "idiomas": [
        "espanhol",
        "japonÃªs",
        "francÃªs",
        "alemÃ£o",
        "inglÃªs"
      ],
      "biografia_md": "# ğŸ‘¤ Luis Sanchez\n\n## ğŸ“‹ **INFORMAÃ‡Ã•ES BÃSICAS**\n- **Nome:** Luis Sanchez\n- **Idade:** 35 anos\n- **Nacionalidade:** Peru\n- **Cargo:** Especialista Recursos Humanos e GestÃ£o de Talentos\n- **EspecializaÃ§Ã£o:** Recursos Humanos e GestÃ£o de Talentos\n\n## ğŸ“ **FORMAÃ‡ÃƒO ACADÃŠMICA**\nBacharelado em Psicologia Organizacional e MBA em GestÃ£o de Pessoas\n\n## ğŸ’¼ **EXPERIÃŠNCIA PROFISSIONAL**\nCom 13 anos de experiÃªncia na Ã¡rea de recursos humanos e gestÃ£o de talentos, Luis Sanchez traz uma perspectiva Ãºnica e valiosa para a TechVision Solutions. \n\nAo longo de sua carreira, ele desenvolveu competÃªncias sÃ³lidas em:\n- GestÃ£o estratÃ©gica e operacional\n- LideranÃ§a de equipes multiculturais\n- Desenvolvimento e implementaÃ§Ã£o de processos\n- AnÃ¡lise e otimizaÃ§Ã£o de resultados\n- ComunicaÃ§Ã£o executiva eficaz\n\n## ğŸŒ **COMPETÃŠNCIAS LINGUÃSTICAS**\n**Idiomas:** espanhol, japonÃªs, francÃªs, alemÃ£o, inglÃªs\n\n## ğŸ¯ **RESPONSABILIDADES NA TECHVISION SOLUTIONS**\nComo Especialista Recursos Humanos e GestÃ£o de Talentos, Luis Sanchez Ã© responsÃ¡vel por:\n- Suporte direto Ã s operaÃ§Ãµes estratÃ©gicas da empresa\n- CoordenaÃ§Ã£o de atividades relacionadas Ã  recursos humanos e gestÃ£o de talentos\n- ImplementaÃ§Ã£o de melhores prÃ¡ticas na Ã¡rea de tecnologia\n- ColaboraÃ§Ã£o com equipes internas e stakeholders externos\n- Desenvolvimento e execuÃ§Ã£o de iniciativas de crescimento\n\n## ğŸ’¡ **COMPETÃŠNCIAS TÃ‰CNICAS**\n- DomÃ­nio de ferramentas de gestÃ£o empresarial\n- Conhecimento avanÃ§ado em metodologias Ã¡geis\n- ExperiÃªncia com sistemas de CRM e ERP\n- AnÃ¡lise de dados e KPIs\n- GestÃ£o de projetos complexos\n\n## ğŸ¤ **COMPETÃŠNCIAS COMPORTAMENTAIS**\n- LideranÃ§a inspiradora e colaborativa\n- ComunicaÃ§Ã£o assertiva e empÃ¡tica\n- Adaptabilidade e flexibilidade\n- Pensamento estratÃ©gico\n- OrientaÃ§Ã£o para resultados\n- Trabalho em equipe multicultural\n\n## ğŸ“ˆ **OBJETIVOS E METAS**\nLuis Sanchez estÃ¡ focado(a) em contribuir para o crescimento sustentÃ¡vel da TechVision Solutions, aplicando sua experiÃªncia em recursos humanos e gestÃ£o de talentos para:\n- Otimizar processos e aumentar a eficiÃªncia operacional\n- Desenvolver soluÃ§Ãµes inovadoras para desafios do setor de tecnologia\n- Fortalecer a cultura organizacional e o engajamento da equipe\n- Expandir a presenÃ§a da empresa no mercado internacional\n\n---\n*Biografia gerada automaticamente pelo Virtual Company Generator*\n*Data: 06/11/2025*",
      "especialidade": "hr",
      "is_ceo": false
    },
    "especialista_youtube": {
      "nome_completo": "Diego Perez",
      "primeiro_nome": "Diego",
      "sobrenome": "Perez",
      "idade": 32,
      "genero": "masculino",
      "pais_origem": "MÃ©xico",
      "nacionalidade": "latinos",
      "role": "Especialista CriaÃ§Ã£o de ConteÃºdo e YouTube Marketing",
      "categoria": "especialistas",
      "especializacao": "CriaÃ§Ã£o de ConteÃºdo e YouTube Marketing",
      "educacao": "Bacharelado em ComunicaÃ§Ã£o Social com especializaÃ§Ã£o em Marketing Digital",
      "anos_experiencia": 10,
      "idiomas": [
        "francÃªs",
        "espanhol",
        "japonÃªs",
        "portuguÃªs",
        "alemÃ£o"
      ],
      "biografia_md": "# ğŸ‘¤ Diego Perez\n\n## ğŸ“‹ **INFORMAÃ‡Ã•ES BÃSICAS**\n- **Nome:** Diego Perez\n- **Idade:** 32 anos\n- **Nacionalidade:** MÃ©xico\n- **Cargo:** Especialista CriaÃ§Ã£o de ConteÃºdo e YouTube Marketing\n- **EspecializaÃ§Ã£o:** CriaÃ§Ã£o de ConteÃºdo e YouTube Marketing\n\n## ğŸ“ **FORMAÃ‡ÃƒO ACADÃŠMICA**\nBacharelado em ComunicaÃ§Ã£o Social com especializaÃ§Ã£o em Marketing Digital\n\n## ğŸ’¼ **EXPERIÃŠNCIA PROFISSIONAL**\nCom 10 anos de experiÃªncia na Ã¡rea de criaÃ§Ã£o de conteÃºdo e youtube marketing, Diego Perez traz uma perspectiva Ãºnica e valiosa para a TechVision Solutions. \n\nAo longo de sua carreira, ele desenvolveu competÃªncias sÃ³lidas em:\n- GestÃ£o estratÃ©gica e operacional\n- LideranÃ§a de equipes multiculturais\n- Desenvolvimento e implementaÃ§Ã£o de processos\n- AnÃ¡lise e otimizaÃ§Ã£o de resultados\n- ComunicaÃ§Ã£o executiva eficaz\n\n## ğŸŒ **COMPETÃŠNCIAS LINGUÃSTICAS**\n**Idiomas:** francÃªs, espanhol, japonÃªs, portuguÃªs, alemÃ£o\n\n## ğŸ¯ **RESPONSABILIDADES NA TECHVISION SOLUTIONS**\nComo Especialista CriaÃ§Ã£o de ConteÃºdo e YouTube Marketing, Diego Perez Ã© responsÃ¡vel por:\n- Suporte direto Ã s operaÃ§Ãµes estratÃ©gicas da empresa\n- CoordenaÃ§Ã£o de atividades relacionadas Ã  criaÃ§Ã£o de conteÃºdo e youtube marketing\n- ImplementaÃ§Ã£o de melhores prÃ¡ticas na Ã¡rea de tecnologia\n- ColaboraÃ§Ã£o com equipes internas e stakeholders externos\n- Desenvolvimento e execuÃ§Ã£o de iniciativas de crescimento\n\n## ğŸ’¡ **COMPETÃŠNCIAS TÃ‰CNICAS**\n- DomÃ­nio de ferramentas de gestÃ£o empresarial\n- Conhecimento avanÃ§ado em metodologias Ã¡geis\n- ExperiÃªncia com sistemas de CRM e ERP\n- AnÃ¡lise de dados e KPIs\n- GestÃ£o de projetos complexos\n\n## ğŸ¤ **COMPETÃŠNCIAS COMPORTAMENTAIS**\n- LideranÃ§a inspiradora e colaborativa\n- ComunicaÃ§Ã£o assertiva e empÃ¡tica\n- Adaptabilidade e flexibilidade\n- Pensamento estratÃ©gico\n- OrientaÃ§Ã£o para resultados\n- Trabalho em equipe multicultural\n\n## ğŸ“ˆ **OBJETIVOS E METAS**\nDiego Perez estÃ¡ focado(a) em contribuir para o crescimento sustentÃ¡vel da TechVision Solutions, aplicando sua experiÃªncia em criaÃ§Ã£o de conteÃºdo e youtube marketing para:\n- Otimizar processos e aumentar a eficiÃªncia operacional\n- Desenvolver soluÃ§Ãµes inovadoras para desafios do setor de tecnologia\n- Fortalecer a cultura organizacional e o engajamento da equipe\n- Expandir a presenÃ§a da empresa no mercado internacional\n\n---\n*Biografia gerada automaticamente pelo Virtual Company Generator*\n*Data: 06/11/2025*",
      "especialidade": "youtube",
      "is_ceo": false
    },
    "especialista_midias_sociais": {
      "nome_completo": "Rafael Silva",
      "primeiro_nome": "Rafael",
      "sobrenome": "Silva",
      "idade": 40,
      "genero": "masculino",
      "pais_origem": "Brasil",
      "nacionalidade": "latinos",
      "role": "Especialista Marketing Digital e MÃ­dias Sociais",
      "categoria": "especialistas",
      "especializacao": "Marketing Digital e MÃ­dias Sociais",
      "educacao": "Bacharelado em Marketing Digital e CertificaÃ§Ã£o Google Analytics",
      "anos_experiencia": 18,
      "idiomas": [
        "francÃªs",
        "alemÃ£o",
        "espanhol",
        "portuguÃªs",
        "japonÃªs",
        "inglÃªs"
      ],
      "biografia_md": "# ğŸ‘¤ Rafael Silva\n\n## ğŸ“‹ **INFORMAÃ‡Ã•ES BÃSICAS**\n- **Nome:** Rafael Silva\n- **Idade:** 40 anos\n- **Nacionalidade:** Brasil\n- **Cargo:** Especialista Marketing Digital e MÃ­dias Sociais\n- **EspecializaÃ§Ã£o:** Marketing Digital e MÃ­dias Sociais\n\n## ğŸ“ **FORMAÃ‡ÃƒO ACADÃŠMICA**\nBacharelado em Marketing Digital e CertificaÃ§Ã£o Google Analytics\n\n## ğŸ’¼ **EXPERIÃŠNCIA PROFISSIONAL**\nCom 18 anos de experiÃªncia na Ã¡rea de marketing digital e mÃ­dias sociais, Rafael Silva traz uma perspectiva Ãºnica e valiosa para a TechVision Solutions. \n\nAo longo de sua carreira, ela desenvolveu competÃªncias sÃ³lidas em:\n- GestÃ£o estratÃ©gica e operacional\n- LideranÃ§a de equipes multiculturais\n- Desenvolvimento e implementaÃ§Ã£o de processos\n- AnÃ¡lise e otimizaÃ§Ã£o de resultados\n- ComunicaÃ§Ã£o executiva eficaz\n\n## ğŸŒ **COMPETÃŠNCIAS LINGUÃSTICAS**\n**Idiomas:** francÃªs, alemÃ£o, espanhol, portuguÃªs, japonÃªs, inglÃªs\n\n## ğŸ¯ **RESPONSABILIDADES NA TECHVISION SOLUTIONS**\nComo Especialista Marketing Digital e MÃ­dias Sociais, Rafael Silva Ã© responsÃ¡vel por:\n- Suporte direto Ã s operaÃ§Ãµes estratÃ©gicas da empresa\n- CoordenaÃ§Ã£o de atividades relacionadas Ã  marketing digital e mÃ­dias sociais\n- ImplementaÃ§Ã£o de melhores prÃ¡ticas na Ã¡rea de tecnologia\n- ColaboraÃ§Ã£o com equipes internas e stakeholders externos\n- Desenvolvimento e execuÃ§Ã£o de iniciativas de crescimento\n\n## ğŸ’¡ **COMPETÃŠNCIAS TÃ‰CNICAS**\n- DomÃ­nio de ferramentas de gestÃ£o empresarial\n- Conhecimento avanÃ§ado em metodologias Ã¡geis\n- ExperiÃªncia com sistemas de CRM e ERP\n- AnÃ¡lise de dados e KPIs\n- GestÃ£o de projetos complexos\n\n## ğŸ¤ **COMPETÃŠNCIAS COMPORTAMENTAIS**\n- LideranÃ§a inspiradora e colaborativa\n- ComunicaÃ§Ã£o assertiva e empÃ¡tica\n- Adaptabilidade e flexibilidade\n- Pensamento estratÃ©gico\n- OrientaÃ§Ã£o para resultados\n- Trabalho em equipe multicultural\n\n## ğŸ“ˆ **OBJETIVOS E METAS**\nRafael Silva estÃ¡ focado(a) em contribuir para o crescimento sustentÃ¡vel da TechVision Solutions, aplicando sua experiÃªncia em marketing digital e mÃ­dias sociais para:\n- Otimizar processos e aumentar a eficiÃªncia operacional\n- Desenvolver soluÃ§Ãµes inovadoras para desafios do setor de tecnologia\n- Fortalecer a cultura organizacional e o engajamento da equipe\n- Expandir a presenÃ§a da empresa no mercado internacional\n\n---\n*Biografia gerada automaticamente pelo Virtual Company Generator*\n*Data: 06/11/2025*",
      "especialidade": "midias_sociais",
      "is_ceo": false
    },
    "especialista_marketing": {
      "nome_completo": "Carmen Silva",
      "primeiro_nome": "Carmen",
      "sobrenome": "Silva",
      "idade": 35,
      "genero": "feminino",
      "pais_origem": "Venezuela",
      "nacionalidade": "latinos",
      "role": "Especialista Marketing EstratÃ©gico e Growth Hacking",
      "categoria": "especialistas",
      "especializacao": "Marketing EstratÃ©gico e Growth Hacking",
      "educacao": "Bacharelado em Marketing e MBA em Growth Marketing",
      "anos_experiencia": 13,
      "idiomas": [
        "inglÃªs",
        "portuguÃªs",
        "japonÃªs",
        "francÃªs",
        "espanhol",
        "alemÃ£o"
      ],
      "biografia_md": "# ğŸ‘¤ Carmen Silva\n\n## ğŸ“‹ **INFORMAÃ‡Ã•ES BÃSICAS**\n- **Nome:** Carmen Silva\n- **Idade:** 35 anos\n- **Nacionalidade:** Venezuela\n- **Cargo:** Especialista Marketing EstratÃ©gico e Growth Hacking\n- **EspecializaÃ§Ã£o:** Marketing EstratÃ©gico e Growth Hacking\n\n## ğŸ“ **FORMAÃ‡ÃƒO ACADÃŠMICA**\nBacharelado em Marketing e MBA em Growth Marketing\n\n## ğŸ’¼ **EXPERIÃŠNCIA PROFISSIONAL**\nCom 13 anos de experiÃªncia na Ã¡rea de marketing estratÃ©gico e growth hacking, Carmen Silva traz uma perspectiva Ãºnica e valiosa para a TechVision Solutions. \n\nAo longo de sua carreira, ela desenvolveu competÃªncias sÃ³lidas em:\n- GestÃ£o estratÃ©gica e operacional\n- LideranÃ§a de equipes multiculturais\n- Desenvolvimento e implementaÃ§Ã£o de processos\n- AnÃ¡lise e otimizaÃ§Ã£o de resultados\n- ComunicaÃ§Ã£o executiva eficaz\n\n## ğŸŒ **COMPETÃŠNCIAS LINGUÃSTICAS**\n**Idiomas:** inglÃªs, portuguÃªs, japonÃªs, francÃªs, espanhol, alemÃ£o\n\n## ğŸ¯ **RESPONSABILIDADES NA TECHVISION SOLUTIONS**\nComo Especialista Marketing EstratÃ©gico e Growth Hacking, Carmen Silva Ã© responsÃ¡vel por:\n- Suporte direto Ã s operaÃ§Ãµes estratÃ©gicas da empresa\n- CoordenaÃ§Ã£o de atividades relacionadas Ã  marketing estratÃ©gico e growth hacking\n- ImplementaÃ§Ã£o de melhores prÃ¡ticas na Ã¡rea de tecnologia\n- ColaboraÃ§Ã£o com equipes internas e stakeholders externos\n- Desenvolvimento e execuÃ§Ã£o de iniciativas de crescimento\n\n## ğŸ’¡ **COMPETÃŠNCIAS TÃ‰CNICAS**\n- DomÃ­nio de ferramentas de gestÃ£o empresarial\n- Conhecimento avanÃ§ado em metodologias Ã¡geis\n- ExperiÃªncia com sistemas de CRM e ERP\n- AnÃ¡lise de dados e KPIs\n- GestÃ£o de projetos complexos\n\n## ğŸ¤ **COMPETÃŠNCIAS COMPORTAMENTAIS**\n- LideranÃ§a inspiradora e colaborativa\n- ComunicaÃ§Ã£o assertiva e empÃ¡tica\n- Adaptabilidade e flexibilidade\n- Pensamento estratÃ©gico\n- OrientaÃ§Ã£o para resultados\n- Trabalho em equipe multicultural\n\n## ğŸ“ˆ **OBJETIVOS E METAS**\nCarmen Silva estÃ¡ focado(a) em contribuir para o crescimento sustentÃ¡vel da TechVision Solutions, aplicando sua experiÃªncia em marketing estratÃ©gico e growth hacking para:\n- Otimizar processos e aumentar a eficiÃªncia operacional\n- Desenvolver soluÃ§Ãµes inovadoras para desafios do setor de tecnologia\n- Fortalecer a cultura organizacional e o engajamento da equipe\n- Expandir a presenÃ§a da empresa no mercado internacional\n\n---\n*Biografia gerada automaticamente pelo Virtual Company Generator*\n*Data: 06/11/2025*",
      "especialidade": "marketing",
      "is_ceo": false
    },
    "especialista_financeiro": {
      "nome_completo": "Carmen Silva",
      "primeiro_nome": "Carmen",
      "sobrenome": "Silva",
      "idade": 40,
      "genero": "feminino",
      "pais_origem": "Venezuela",
      "nacionalidade": "latinos",
      "role": "Especialista AnÃ¡lise Financeira e Controladoria",
      "categoria": "especialistas",
      "especializacao": "AnÃ¡lise Financeira e Controladoria",
      "educacao": "Bacharelado em CiÃªncias ContÃ¡beis e CFA Charter",
      "anos_experiencia": 18,
      "idiomas": [
        "espanhol",
        "portuguÃªs",
        "francÃªs",
        "japonÃªs",
        "alemÃ£o",
        "inglÃªs"
      ],
      "biografia_md": "# ğŸ‘¤ Carmen Silva\n\n## ğŸ“‹ **INFORMAÃ‡Ã•ES BÃSICAS**\n- **Nome:** Carmen Silva\n- **Idade:** 40 anos\n- **Nacionalidade:** Venezuela\n- **Cargo:** Especialista AnÃ¡lise Financeira e Controladoria\n- **EspecializaÃ§Ã£o:** AnÃ¡lise Financeira e Controladoria\n\n## ğŸ“ **FORMAÃ‡ÃƒO ACADÃŠMICA**\nBacharelado em CiÃªncias ContÃ¡beis e CFA Charter\n\n## ğŸ’¼ **EXPERIÃŠNCIA PROFISSIONAL**\nCom 18 anos de experiÃªncia na Ã¡rea de anÃ¡lise financeira e controladoria, Carmen Silva traz uma perspectiva Ãºnica e valiosa para a TechVision Solutions. \n\nAo longo de sua carreira, ela desenvolveu competÃªncias sÃ³lidas em:\n- GestÃ£o estratÃ©gica e operacional\n- LideranÃ§a de equipes multiculturais\n- Desenvolvimento e implementaÃ§Ã£o de processos\n- AnÃ¡lise e otimizaÃ§Ã£o de resultados\n- ComunicaÃ§Ã£o executiva eficaz\n\n## ğŸŒ **COMPETÃŠNCIAS LINGUÃSTICAS**\n**Idiomas:** espanhol, portuguÃªs, francÃªs, japonÃªs, alemÃ£o, inglÃªs\n\n## ğŸ¯ **RESPONSABILIDADES NA TECHVISION SOLUTIONS**\nComo Especialista AnÃ¡lise Financeira e Controladoria, Carmen Silva Ã© responsÃ¡vel por:\n- Suporte direto Ã s operaÃ§Ãµes estratÃ©gicas da empresa\n- CoordenaÃ§Ã£o de atividades relacionadas Ã  anÃ¡lise financeira e controladoria\n- ImplementaÃ§Ã£o de melhores prÃ¡ticas na Ã¡rea de tecnologia\n- ColaboraÃ§Ã£o com equipes internas e stakeholders externos\n- Desenvolvimento e execuÃ§Ã£o de iniciativas de crescimento\n\n## ğŸ’¡ **COMPETÃŠNCIAS TÃ‰CNICAS**\n- DomÃ­nio de ferramentas de gestÃ£o empresarial\n- Conhecimento avanÃ§ado em metodologias Ã¡geis\n- ExperiÃªncia com sistemas de CRM e ERP\n- AnÃ¡lise de dados e KPIs\n- GestÃ£o de projetos complexos\n\n## ğŸ¤ **COMPETÃŠNCIAS COMPORTAMENTAIS**\n- LideranÃ§a inspiradora e colaborativa\n- ComunicaÃ§Ã£o assertiva e empÃ¡tica\n- Adaptabilidade e flexibilidade\n- Pensamento estratÃ©gico\n- OrientaÃ§Ã£o para resultados\n- Trabalho em equipe multicultural\n\n## ğŸ“ˆ **OBJETIVOS E METAS**\nCarmen Silva estÃ¡ focado(a) em contribuir para o crescimento sustentÃ¡vel da TechVision Solutions, aplicando sua experiÃªncia em anÃ¡lise financeira e controladoria para:\n- Otimizar processos e aumentar a eficiÃªncia operacional\n- Desenvolver soluÃ§Ãµes inovadoras para desafios do setor de tecnologia\n- Fortalecer a cultura organizacional e o engajamento da equipe\n- Expandir a presenÃ§a da empresa no mercado internacional\n\n---\n*Biografia gerada automaticamente pelo Virtual Company Generator*\n*Data: 06/11/2025*",
      "especialidade": "financeiro",
      "is_ceo": false
    },
    "especialista_tecnologia": {
      "nome_completo": "Isabella Sanchez",
      "primeiro_nome": "Isabella",
      "sobrenome": "Sanchez",
      "idade": 38,
      "genero": "feminino",
      "pais_origem": "Brasil",
      "nacionalidade": "latinos",
      "role": "Especialista Desenvolvimento de Sistemas e DevOps",
      "categoria": "especialistas",
      "especializacao": "Desenvolvimento de Sistemas e DevOps",
      "educacao": "Bacharelado em CiÃªncia da ComputaÃ§Ã£o e CertificaÃ§Ãµes AWS",
      "anos_experiencia": 16,
      "idiomas": [
        "inglÃªs",
        "francÃªs",
        "portuguÃªs",
        "espanhol"
      ],
      "biografia_md": "# ğŸ‘¤ Isabella Sanchez\n\n## ğŸ“‹ **INFORMAÃ‡Ã•ES BÃSICAS**\n- **Nome:** Isabella Sanchez\n- **Idade:** 38 anos\n- **Nacionalidade:** Brasil\n- **Cargo:** Especialista Desenvolvimento de Sistemas e DevOps\n- **EspecializaÃ§Ã£o:** Desenvolvimento de Sistemas e DevOps\n\n## ğŸ“ **FORMAÃ‡ÃƒO ACADÃŠMICA**\nBacharelado em CiÃªncia da ComputaÃ§Ã£o e CertificaÃ§Ãµes AWS\n\n## ğŸ’¼ **EXPERIÃŠNCIA PROFISSIONAL**\nCom 16 anos de experiÃªncia na Ã¡rea de desenvolvimento de sistemas e devops, Isabella Sanchez traz uma perspectiva Ãºnica e valiosa para a TechVision Solutions. \n\nAo longo de sua carreira, ela desenvolveu competÃªncias sÃ³lidas em:\n- GestÃ£o estratÃ©gica e operacional\n- LideranÃ§a de equipes multiculturais\n- Desenvolvimento e implementaÃ§Ã£o de processos\n- AnÃ¡lise e otimizaÃ§Ã£o de resultados\n- ComunicaÃ§Ã£o executiva eficaz\n\n## ğŸŒ **COMPETÃŠNCIAS LINGUÃSTICAS**\n**Idiomas:** inglÃªs, francÃªs, portuguÃªs, espanhol\n\n## ğŸ¯ **RESPONSABILIDADES NA TECHVISION SOLUTIONS**\nComo Especialista Desenvolvimento de Sistemas e DevOps, Isabella Sanchez Ã© responsÃ¡vel por:\n- Suporte direto Ã s operaÃ§Ãµes estratÃ©gicas da empresa\n- CoordenaÃ§Ã£o de atividades relacionadas Ã  desenvolvimento de sistemas e devops\n- ImplementaÃ§Ã£o de melhores prÃ¡ticas na Ã¡rea de tecnologia\n- ColaboraÃ§Ã£o com equipes internas e stakeholders externos\n- Desenvolvimento e execuÃ§Ã£o de iniciativas de crescimento\n\n## ğŸ’¡ **COMPETÃŠNCIAS TÃ‰CNICAS**\n- DomÃ­nio de ferramentas de gestÃ£o empresarial\n- Conhecimento avanÃ§ado em metodologias Ã¡geis\n- ExperiÃªncia com sistemas de CRM e ERP\n- AnÃ¡lise de dados e KPIs\n- GestÃ£o de projetos complexos\n\n## ğŸ¤ **COMPETÃŠNCIAS COMPORTAMENTAIS**\n- LideranÃ§a inspiradora e colaborativa\n- ComunicaÃ§Ã£o assertiva e empÃ¡tica\n- Adaptabilidade e flexibilidade\n- Pensamento estratÃ©gico\n- OrientaÃ§Ã£o para resultados\n- Trabalho em equipe multicultural\n\n## ğŸ“ˆ **OBJETIVOS E METAS**\nIsabella Sanchez estÃ¡ focado(a) em contribuir para o crescimento sustentÃ¡vel da TechVision Solutions, aplicando sua experiÃªncia em desenvolvimento de sistemas e devops para:\n- Otimizar processos e aumentar a eficiÃªncia operacional\n- Desenvolver soluÃ§Ãµes inovadoras para desafios do setor de tecnologia\n- Fortalecer a cultura organizacional e o engajamento da equipe\n- Expandir a presenÃ§a da empresa no mercado internacional\n\n---\n*Biografia gerada automaticamente pelo Virtual Company Generator*\n*Data: 06/11/2025*",
      "especialidade": "tecnologia",
      "is_ceo": false
    }
  }
}